"","jacket","pants","padding","coat","shirt","sweatshirt","mentomen","pack","shorts","cap","socks","shoes","necklace","gardigan","jean","neat","jumper","tshirt"
"98","8oz 오버사이즈 ma-1 항공 점퍼 자켓 mfzpd003-bk","m2043_시티 코튼 치노 팬츠 (베이지)",NA,"오버사이즈 발마칸 맥코트 - 블랙  (fl-010)","오버사이즈 워싱 코튼 셔츠 화이트",NA,NA,NA,NA,NA,NA,"bolt lo 볼트 로우 펠트 스니커즈 내추럴(ff_m6017fl_be)",NA,NA,"odpl 와이드 데님 팬츠 애쉬그레이","u 아가일 니트 베스트 uni argyle knit vest",NA,"베이식 긴팔 티셔츠 [더스티 그린]"
"99","m-51 피쉬테일 숏 자켓 올리브","투턱 와이드 팬츠 (다크차콜)",NA,"빅 카라 오버 발마칸 코트 (black)","오버사이즈 피케 스웨트셔츠 그레이쉬 블루",NA,NA,NA,NA,NA,NA,"남성용 서스테이너블 터레인 로 스니커즈 mexaamm14wt",NA,NA,"[사은품 증정]데님 팬츠 h1 #004 세미 와이드 핏 청바지 화이트 dcpth1004white","[2pack] 캐시미어 블렌드 라운드 니트 세트",NA,"릴렉스드 긴팔 티셔츠 [화이트]"
"100","클래식 로고 바시티 자켓_네이비","포켓 라벨 사이드 트임 데님 팬츠 (흑청)",NA,"울 블랜드 롱 트렌치 코트 black","시티보이 보트자수 옥스포드 오버핏 셔츠 (white)",NA,NA,NA,NA,NA,NA,"독일군 스니커즈 [올 화이트]",NA,NA,"가죽 트림 데님 토트 - 네이비","울 니트 가디건 자켓_brown",NA,"오버핏 레이어드 롱티셔츠 아이보리 kjlt2153"
"101","리버시블 라이트 다운 자켓 베이지","논코드 인디고 데님 팬츠_블랙",NA,"울리치 세미오버핏 싱글 체크 코트 [앤트러사이트]","이지 케어 오버 셔츠 화이트",NA,NA,NA,NA,NA,NA,"5cm 유니섹스 독일군 스니커즈 제너럴(cl0035)",NA,NA,"lot.026 헐리우드 슬림 데님 블랙 원워시","특양기모 목폴라 니트 티셔츠 off white",NA,"wsk 스트라이프 코튼 럭비 티셔츠 - 그린 x 네이비"
"102","숏 피쉬테일 자켓 인디고 다크","퍼티그 팬츠 크림",NA,"mtr 캐시미어 더블 코트 beige","세미오버핏 플리티드 셔츠 (화이트)",NA,NA,NA,NA,NA,NA,"(542023 w1gb1 9000) 남성 트랙 스니커즈 20ss",NA,NA,"쿨맥스 슬림 크롭 데님 팬츠 [블랙]","wmm 코튼 크리켓 니트 - 오트밀 x 네이비",NA,"듀라빌리티 롱 슬리브 티셔츠 [오프화이트]"
"103","마운틴 후드 자켓_아이보리","로프 와이드 더블 데님 팬츠",NA,"울리치 발마칸 오버 코트_oatmeal","폰테 터틀 넥 긴팔 티셔츠 [오프 화이트]",NA,NA,NA,NA,NA,NA,NA,NA,NA,"논코드 인디고 데님 팬츠_블랙","남성 타이거 크래스트 니트 - 크림 / fb65pu6423ta04",NA,"베이직 레이어드 티셔츠 [블랙/아이보리]"
"104","클래식 로고 바시티 자켓_베이지","세미 와이드핏 롱 데님 팬츠_아이보리",NA,"솔리드 숏 울 코트 (베이지)","오버 핏 옥스포드 셔츠 [화이트]",NA,NA,NA,NA,NA,NA,NA,NA,NA,"odpl 와이드 데님 팬츠 블랙","20f/w 울 터틀넥 니트 (그레이)",NA,"터틀 하이 벤트 레이어드 티셔츠 [black]"
"105","포스 워싱 타슬란 바람막이 자켓 (그레이)","calik 슬림 크롭 데님 팬츠 [블랙]",NA,"건 클럽 체크 대디 숄더 싱글 롱 코트 [브라운]","시그니처 클럽 셔츠_화이트",NA,NA,NA,NA,NA,NA,NA,NA,NA,"와이드 인더 데님_블랙","컷 오프 루즈핏 니트_아이보리",NA,"2012 롱슬리브 티셔츠 화이트"
"106","오버사이즈 워시드 데님 자켓  딥 인디고","테이퍼드 크롭 데님 팬츠 [워시드 블랙]",NA,"발마칸 체크 로브 코트","워시드 옥스포드 셔츠 s87 화이트",NA,NA,NA,NA,NA,NA,NA,NA,NA,"와이드 데님 팬츠 (r.black)","리버스드 레터링 라운드 니트 [cream beige]",NA,"하프넥 롱슬리브 티셔츠 (ivory)"
"107","차일드 플래그 플리스 자켓_오트밀","논코드 인디고 데님 팬츠_블랙",NA,"유니섹스 히든 스냅 덕다운 맥 코트 카키 iro068","옵티멀 베이직 린넨 셔츠-화이트",NA,NA,NA,NA,NA,NA,NA,NA,NA,"쿨맥스 슬림 크롭 데님 팬츠 [블랙]","캐시미어 100 크루 넥 니트 [아이보리]",NA,"(unisex)네츄럴 하프 니트 폴라 티셔츠_black"
"108","클래식 로고 바시티 자켓_네이비","odpl 와이드 데님 팬츠 애쉬그레이",NA,"세미 오버 싱글 코트 [블랙]","[아노블리어 x 니티드] 루즈핏 얼터너티브 스트라이프 셔츠 [네이비]",NA,NA,NA,NA,NA,NA,NA,NA,NA,"calik 슬림 크롭 데님 팬츠 [블랙]","캐시미어 블렌드 터틀 넥 니트 [아보카도]",NA,"화이트라벨 포켓 롱 슬리브 티셔츠 블랙"
"109","[24005]남여공용 봄 가을 로브 자켓 한복 선염 무명 17수 브이넥","[사은품 증정]데님 팬츠 h1 #004 세미 와이드 핏 청바지 화이트 dcpth1004white",NA,"솔리드 울 맥코트 (베이지)","유틸리티 커브 포켓 옥스포드 셔츠 화이트",NA,NA,NA,NA,NA,NA,NA,NA,NA,"펠리페블랙 테이퍼드 데님 팬츠","그래픽 터틀넥 니트 (블랙)_ pb3kn0808",NA,"기자 cp 스판 세미오버핏 티셔츠 (스카이블루)"
"110","패커블 컴포트 싱글 자켓 블랙","쿨맥스 슬림 크롭 데님 팬츠 [블랙]",NA,"울리치 발마칸 오버 코트_black","버티컬 팁 베이직 셔츠 릴렉스드핏 그레이",NA,NA,NA,NA,NA,NA,NA,NA,NA,"에크루 테이퍼드 크롭 데님 팬츠","agp 크루넥 울 니트 아이보리",NA,"오픈카라 티셔츠 [dusty cream]"
"111","c 로고 울 바시티 자켓 카키","논코드 인디고 데님 팬츠_블랙",NA,"오버사이즈 건 클럽 체크 맥 코트 [브라운]","라이트웨이트 패널 스웨트셔츠 black",NA,NA,NA,NA,NA,NA,NA,NA,NA,"paul303 와이드핏 데님진(블랙)","베이직 니트 체크 머플러 - 20color",NA,"릭렉스 우븐 티셔츠 relax woven ts"
"112","스테디 피시테일 자켓 카키 jdot1320","odpl 와이드 데님 팬츠 블랙",NA,"오버사이즈 울 트렌치 코트 [greige]","시티보이 보트자수 옥스포드 오버핏 셔츠 (white)",NA,NA,NA,NA,NA,NA,NA,NA,NA,"v114 와이드 로우 데님 팬츠 (블루)","미니멀 울 반목폴라 니트 [블랙]",NA,"수피마 코튼 프리미엄 티셔츠 dark green"
"113","헥사곤 퀼팅 자켓 블랙","us cocl 울 세미 와이드 팬츠 블랙 coospt182black",NA,"울 블렌드 오버사이즈 트렌치 코트 [베이지]","브리드 모크넥 롱 슬리브 티셔츠 [white]",NA,NA,NA,NA,NA,NA,NA,NA,NA,"와이드 데님 팬츠 (r.black)","모헤어 스트라이프 니트_brown",NA,"코튼 니트 티셔츠 avocado"
"114","nbnmc12053 / uni 바시티 스타디움 자켓 (white)","와이드 데님 팬츠 (r.black)",NA,"오버사이즈 싱글 코트 [라이트 그레이]","[패키지] 텐스 오버핏 터틀넥 티셔츠 6종 2pack yhlt2309",NA,NA,NA,NA,NA,NA,NA,NA,NA,"알라모_케비어 블랙 데님","소프트 울터치 무지 숏 미니 니트머플러3 (c2104-am095_brd)",NA,NA
"115","데님 트러커 자켓 (인디고)","루즈테이퍼드 울블렌드 팬츠 heather charcoal",NA,"오버사이즈 울 트렌치 코트 [charcoal]","041901 브러쉬드 링클프리 이지케어 셔츠 (10041901)",NA,NA,NA,NA,NA,NA,NA,NA,NA,"뉴슬로 와이드 데님 팬츠 [cream]","니트_아를_로지 베이지",NA,NA
"116","빅 로고 트랙 자켓 네이비","쿨맥스 슬림 크롭 데님 팬츠 [블랙]",NA,"오버사이즈 울 트렌치 코트 [beige]","m0038 오버핏 코튼 셔츠 (화이트)",NA,NA,NA,NA,NA,NA,NA,NA,NA,"dp-t908 테이퍼드핏 데님 팬츠_bk","캐시미어 라운드 니트 green",NA,NA
"117","2-way 유틸리티 ma-1 자켓_블랙","calik 슬림 크롭 데님 팬츠 [블랙]",NA,"오버사이즈 트렌치 코트 cream","폴리 셔츠 s37-2 베이지",NA,NA,NA,NA,NA,NA,NA,NA,NA,"레귤러 스트레이트 데님 (블랙)","플래그 니트 가디건_화이트",NA,NA
"118","남 j319568 ps8 그레이 숏 로고 다운 푸퍼 자켓","펠리페블랙 테이퍼드 데님 팬츠",NA,"오버사이즈 트렌치 코트 dark brown","하프 폴라 니트 티셔츠 오프화이트",NA,NA,NA,NA,NA,NA,NA,NA,NA,"가죽 트림 데님 토트 - 네이비","캐시미어 울 니트라운드 딥오렌지 20swfwknr",NA,NA
"119","c로고 바시티 자켓 네이비","에크루 테이퍼드 크롭 데님 팬츠",NA,"울 블렌디드 로브 트렌치 코트 [블랙]","하프 폴라 니트 티셔츠 블랙",NA,NA,NA,NA,NA,NA,NA,NA,NA,"calik 슬림 크롭 데님 팬츠 [블랙]","모헤어 칼라 블럭 니트 블랙",NA,NA
"120","flight worker 워크 자켓 beige","v114 와이드 로우 데님 팬츠 (블루)",NA,"오버사이즈 트렌치 코트 chambray","릴렉스 핏 옥스포드 워크 셔츠 [베이지]",NA,NA,NA,NA,NA,NA,NA,NA,NA,"알라모_케비어 블랙 데님","미니멀 크루 넥 니트 [라이트 그레이]",NA,NA
"121","[22ss] 겜빗 스타디움 자켓 블랙 juot4459","와이드 데님 팬츠 (r.black)",NA,"울 블렌디드 로브 트렌치 코트 [블랙]","플란넬 아우터 셔츠 (카키브라운)",NA,NA,NA,NA,NA,NA,NA,NA,NA,"m150 스트레이트 데님 팬츠_흑청","램스울 리브드 브이 넥 니트 [베이지]",NA,NA
"122","프리즈 숏 다운 자켓 orange","뉴슬로 와이드 데님 팬츠 [cream]",NA,"더블 브레스티드 캐시미어 코트 dark brown","시티보이 보트자수 옥스포드 오버핏 셔츠 (white)",NA,NA,NA,NA,NA,NA,NA,NA,NA,"paul305 와이드핏 절개 데님진 (블랙)","미니멀 크루 넥 니트 [미디엄 그레이]",NA,NA
"123","3m 신슐레이트 플랩 푸퍼 패딩 자켓 브라운","dp-t908 테이퍼드핏 데님 팬츠_bk",NA,"에센셜 세미 오버 핏 코튼 트렌치 코트 베이지","셔링 셔츠 휴머스",NA,NA,NA,NA,NA,NA,NA,NA,NA,"슬림 스트레이트 데님 (블랙)","오버핏 브러쉬 아가일 니트 가디건 [화이트]",NA,NA
"124","리치 오버 ma-1 자켓 블랙 yhjk2269","와이드 팬츠 블랙",NA,"루즈핏 워시드 맥코트 mc 04 gy","(unisex) 스탠다드 셔츠 ver2 _솔리드 화이트",NA,NA,NA,NA,NA,NA,NA,NA,NA,"kipas 슬림 크롭 데님 팬츠 [미디엄 인디고]","모헤어 스트라이프 니트_gray",NA,NA
"125","코튼 트러커 자켓 (블랙)","calik 슬림 크롭 데님 팬츠 [블랙]",NA,"코튼 오버사이즈 트렌치 코트 [더스티 베이지]","[세트]  하프 폴라 니트 티셔츠",NA,NA,NA,NA,NA,NA,NA,NA,NA,"쿨맥스 슬림 크롭 데님 팬츠 [미디엄 인디고]","블랙 베이직 터틀넥 니트",NA,NA
"126","바시티크루 자켓 버건디 stot3400","m150 스트레이트 데님 팬츠_흑청",NA,"레더 코트 스니커즈 [화이트]","릴렉스 핏 옥스포드 워크 셔츠 [그레이]",NA,NA,NA,NA,NA,NA,NA,NA,NA,"카마로_벨티드 로우 데님","울 트위드 라운드 니트 네이비 블랙",NA,NA
"127","오버룩700f 패딩 자켓 3종 베이지 jhot1290","kipas 슬림 크롭 데님 팬츠 [미디엄 인디고]",NA,"레더 코트 스니커즈 [화이트]","오버사이즈 히든 미니멀 셔츠 [white]",NA,NA,NA,NA,NA,NA,NA,NA,NA,"스타터 워시드 와이드 데님 (city gray)","크루넥 리브 니트 스웨터_브라운",NA,NA
"128","소프트 터치 보아 플리스 자켓 (베이지)","쿨맥스 슬림 크롭 데님 팬츠 [미디엄 인디고]",NA,"레더 코트 스니커즈 [블랙]","시티보이 보트자수 옥스포드 오버핏 셔츠 (white)",NA,NA,NA,NA,NA,NA,NA,NA,NA,"lot.026 헐리우드 슬림 데님 블랙 원워시","라쿠 로고 오버니트(오트밀)",NA,NA
"129","리버시블 바시티 봄버 자켓 l-베이지","테이퍼드 밴딩 코튼 팬츠 (블랙)",NA,"헤리티지 코트 ii 스니커즈 - 화이트:그린","[드로우핏x깡스타일리스트] 터틀넥 니트 티셔츠 set",NA,NA,NA,NA,NA,NA,NA,NA,NA,"paul303 와이드핏 데님진(블랙)","니트_아를_프러시안 블루",NA,NA
"130","3m 신슐레이트 스타디움 자켓 카키","쿨맥스 슬림 크롭 데님 팬츠 [미디엄 인디고]",NA,"레더 코트 스니커즈 [화이트]","미니멀 히든버튼 셔츠 [화이트]",NA,NA,NA,NA,NA,NA,NA,NA,NA,"쿨맥스 슬림 크롭 데님 팬츠 [미디엄 인디고]","울 모헤어 스트라이프 니트 아이보리",NA,NA
"131","윈터 체크 플리스 자켓_그레이","테이퍼드 크롭 데님 팬츠 [워시드 블랙]",NA,"사이드 슬릿 에센셜 맥 코트_아이보리","cb 클래식 셔츠 (브라운)",NA,NA,NA,NA,NA,NA,NA,NA,NA,"테이퍼드 크롭 데님 팬츠 [워시드 블랙]","u 아가일 니트 베스트 uni argyle knit vest",NA,NA
"132","바시티크루 자켓 딥그레이 stot3400","블랙 테이퍼드 크롭 데님 팬츠",NA,"스톰 플랩 코트 블랙","m0038 오버핏 코튼 셔츠 (화이트)",NA,NA,NA,NA,NA,NA,NA,NA,NA,"블랙 테이퍼드 크롭 데님 팬츠","컨템포러리 울 하프 집업 니트 아이보리 cooskt026ivory",NA,NA
"133","퀼티드 밀리터리 자켓 블랙","m150 스트레이트 데님 팬츠_흑청",NA,"솔리드 숏 울 코트 (베이지)","릴렉스 핏 옥스포드 셔츠 [크림]",NA,NA,NA,NA,NA,NA,NA,NA,NA,"m150 스트레이트 데님 팬츠_흑청","헤링본 램스 울 니트 가디건 아이보리 cooscd011ivory",NA,NA
"134","페블스톤 숏 패딩 자켓 pebblestone short padding jacket","t/r 더블 플리츠 테이퍼드핏 슬랙스 팬츠 블랙",NA,"라이트 그레이 싱글 브레스티드 코트 (261130dye2)","릴렉스 핏 옥스포드 워크 셔츠 [크림]",NA,NA,NA,NA,NA,NA,NA,NA,NA,"테이퍼드 데님 (블랙)","[men collection] 라이드 메리노 터틀넥 니트 2008298609010009",NA,NA
"135","c 로고 울 바시티 자켓 네이비","p[1009]롱 와이드 코튼팬츠 (크림)",NA,"울리치 히든 싱글 롱 체크 코트 [포레스트그린]","[아노블리어 x 키르시] 스몰체리 옥스포드 셔츠 [화이트]",NA,NA,NA,NA,NA,NA,NA,NA,NA,"calik 슬림 크롭 데님 팬츠 [블랙]","베이직 크루 니트 (ts50)",NA,NA
"136","플리스 버튼 자켓_오트밀","calik 슬림 크롭 데님 팬츠 [블랙]",NA,"헤비 울 오버핏 블레이저 코트_애쉬 그레이","피그먼트 스웨트셔츠 (베이지)",NA,NA,NA,NA,NA,NA,NA,NA,NA,"052 와이드핏 데님진 내츄럴크림","울 트위드 라운드 니트 네이비 블랙",NA,NA
"137","코듀로이 다운 자켓(fs2djd4105xegy)","calik 슬림 크롭 데님 팬츠 [블랙]",NA,"트위드 울 오버핏 블레이저 코트_라이트 베이지","오버사이즈 피케 스웨트셔츠 베이지",NA,NA,NA,NA,NA,NA,NA,NA,NA,"paul305 와이드핏 절개 데님진 (블랙)","니트_아를_프러시안 블루",NA,NA
"138","스웨이드 숏 다운 자켓 베이지 x 브라운","와이드 데님 팬츠 of35 (흑청)",NA,"솔리드 숏 울 코트 (블랙)","릴렉스 핏 옥스포드 워크 셔츠 [화이트]",NA,NA,NA,NA,NA,NA,NA,NA,NA,"lot.026 헐리우드 슬림 데님 원워시","토마스 모헤어 니트 [아이보리]",NA,NA
"139","알래스카 자켓_블랙","컬러와이드데님팬츠(크림)",NA,"레더 코트 스니커즈 [화이트]","[fw버전] 기모 옥스포드 세미오버 프렌치 셔츠_off white",NA,NA,NA,NA,NA,NA,NA,NA,NA,"calik 슬림 크롭 데님 팬츠 [블랙]","cntt 소프트 알파카 울 니트(그레이)",NA,NA
"140","sp 리버시블 플리스 집업 자켓-화이트","디지털 프린팅 루즈핏 팬츠 grey",NA,"솔리디티 세미오버핏 발마칸 코트 [블랙]","커스텀핏 버튼다운 옥스포드 셔츠  - 블루",NA,NA,NA,NA,NA,NA,NA,NA,NA,"브러쉬 워시드 와이드 데님 (deep gray)","소프트  하찌 니트 스웨터_브라운",NA,NA
"141","밀리터리 리버서블 크루넥 다운 자켓 - 블랙:블랙 / taion-r104bml-1-black","테이퍼드 크롭 데님 팬츠 [워시드 블랙]",NA,"(unisex)기프트 더블코트","[패키지] 매치오버핏 셔츠 4종 bjls4410",NA,NA,NA,NA,NA,NA,NA,NA,NA,"와이드 데님 팬츠 of35 (흑청)","햄스테드 램스울 니트 와사비",NA,NA
"142","시티캠퍼 롱다운 자켓_yg","포텐 와이드  팬츠 블랙 / gm31bk-1791ss21",NA,"캐시미어 로브 코트 (블루그레이)","하프넥 반팔 티셔츠 (ivory)",NA,NA,NA,NA,NA,NA,NA,NA,NA,"컬러와이드데님팬츠(크림)","레터링 앙고라 니트 ( ivory)",NA,NA
"143","3m 신슐레이트 보아 플리스 무톤 자켓 카키","베이직 스판 데님 팬츠 [블랙]",NA,"솔리드 칼라 숏 더플 코트 (블랙)","에센셜 옥스포드 셔츠 essential oxford shirts",NA,NA,NA,NA,NA,NA,NA,NA,NA,"테이퍼드 크롭 데님 팬츠 [워시드 블랙]","캐시미어 블렌드 리브드 터틀 넥 니트 [더스트 핑크]",NA,NA
"144","bel&co 수피마 구스 다운 자켓 black","m139 스트레이트 콘 생지 데님 팬츠_인디고",NA,"무스탕 더블 코트 [브라운]","심플 모크넥 롱 슬리브 티셔츠_off white",NA,NA,NA,NA,NA,NA,NA,NA,NA,"카이엔_원턱 테일러드 벨티드데님","슬릿 하이넥 니트 grey beige",NA,NA
"145","빅오버 플리스 집업 자켓_midnight blue","슬림 스트레이트 블랙 팬츠",NA,"오버사이즈 더블 코트 (네이비)","[men collection] 제이슨 스트레치 트윌 오버셔츠 2101336040040002",NA,NA,NA,NA,NA,NA,NA,NA,NA,"베이직 스판 데님 팬츠 [블랙]","벌키 브러쉬 솔리드 니트 ivory",NA,NA
"146","셰르파 유틸리티 자켓 cream","와이드 스트레이트 데님 팬츠 딤 블루",NA,"울리치 발마칸 오버 코트_black","커스텀 슬림핏 저지 롱슬리브 티셔츠 - 화이트",NA,NA,NA,NA,NA,NA,NA,NA,NA,"m139 스트레이트 콘 생지 데님 팬츠_인디고","[essential] unisex 아이보리 케이블 라운드넥 니트 (bc1851a110)",NA,NA
"147","pt 트랙자켓 black","코튼 페인터 팬츠 화이트",NA,"프리미어 퓨어 캐시미어 히든 싱글 코트 [black]","로고 옥스퍼드 셔츠_화이트",NA,NA,NA,NA,NA,NA,NA,NA,NA,"와이드 스트레이트 데님 팬츠 딤 블루","특양기모 목폴라 니트 티셔츠 off white",NA,NA
"148","에센셜 다운 자켓 grey","쿨맥스 슬림 크롭 데님 팬츠 [미디엄 인디고]",NA,"트윌 워킹 코트  - 네이비","오버핏 옥스퍼드 셔츠 (white)",NA,NA,NA,NA,NA,NA,NA,NA,NA,"쿨맥스 슬림 크롭 데님 팬츠 [미디엄 인디고]","세미오버핏 케이블 니트 베스트 [크림]",NA,NA
"149","버킷리스트 a1 자켓_bk","calik 스트레이트 데님 팬츠 [워시드 블랙]",NA,"캐시미어 20 오버사이즈 더블 코트 [카멜]","오버사이즈 피케 스웨트셔츠 블랙",NA,NA,NA,NA,NA,NA,NA,NA,NA,"calik 스트레이트 데님 팬츠 [워시드 블랙]","울 트위드 라운드 니트 네이비 블랙",NA,NA
"150","35 패딩 자켓 blue","odpl 와이드 데님 팬츠 블랙",NA,"남성 울혼방 블랙 베이직 오버핏 더블 코트","dying 코튼 셔츠 brown",NA,NA,NA,NA,NA,NA,NA,NA,NA,"odpl 와이드 데님 팬츠 블랙","램스울 크루넥 오버니트(카키)",NA,NA
"151","웨이브 컴포트핏 퀼팅 자켓(라이트 베이지)","세미부츠컷 팬츠 (블랙)",NA,"발마칸 포켓 울오버 코트 베이지","[세트]  하프 폴라 니트 티셔츠",NA,NA,NA,NA,NA,NA,NA,NA,NA,"스트레이트 와이드 데님 (deep gray)","sw1403 램스울 라운드 니트-화이트그레이",NA,NA
"152","코듀로이 양털 후리스 뽀글이 오버사이즈 자켓 카키","henry 투턱 벨티드 팬츠_블랙",NA,"리즈 핸드메이드 더블 코트 leeds handmade double coat (brown)","세미오버 미니멀 셔츠 2 pack",NA,NA,NA,NA,NA,NA,NA,NA,NA,"052 와이드핏 데님진 내츄럴크림","남성 베이직 니트 (아이보리)",NA,NA
"153","울 바시티 자켓 (화이트라인)","플리츠 세미 와이드 팬츠  - 브라운",NA,"울리치  더블 브레스트 롱 체크 코트 [미스틱그레이]","라쿠 하프스트라이프 오버티셔츠(오트밀+네이비)",NA,NA,NA,NA,NA,NA,NA,NA,NA,"스트레이트 와이드 데님 (deep gray)","퍼펙트 터틀넥 니트 티셔츠 블랙",NA,NA
"154","오리지널 스타일 푸퍼 숏다운자켓 md-x721","와이드 플리츠 밴딩 팬츠 그레이",NA,"캐시미어 20 오버사이즈 더블 코트 [카멜]","링클 디포머 아웃핏 셔츠_블랙",NA,NA,NA,NA,NA,NA,NA,NA,NA,"paul306 와이드핏 절개 데님진 (크림)","바우_니트후드_샌드 쉘 아이보리",NA,NA
"155","fila sports 플리스 집업자켓(fe2jkd6118xkhi)","루즈 테이퍼드 밴딩 팬츠 네이비",NA,"캐시미어 블렌드 오버사이즈 싱글 코트 [네이비]","[패키지] 매치오버핏 셔츠 4종 bjls4410",NA,NA,NA,NA,NA,NA,NA,NA,NA,"스톰 화이트 와이드 데님","단가라 니트 아이보리_003",NA,NA
"156","브루클린 이글스 bb 자켓 카키","레귤러 핏 데님 팬츠 [미디엄 인디고]",NA,"발마칸 코트 (하운드투스)","커브드 리브 스웨트셔츠 cream",NA,NA,NA,NA,NA,NA,NA,NA,NA,"레귤러 핏 데님 팬츠 [미디엄 인디고]","부클 리버스 스페이스 다잉 니트_민트그린",NA,NA
"157","오버룩700f 패딩 자켓 3종 베이지 jhot1290","calik 스트레이트 데님 팬츠 [워시드 블랙]",NA,"캐시미어 20 오버사이즈 더블 코트 [카멜]","라이트웨이트 패널 스웨트셔츠 white",NA,NA,NA,NA,NA,NA,NA,NA,NA,"calik 스트레이트 데님 팬츠 [워시드 블랙]","세미오버 베이직 라운드 니트_multi pink",NA,NA
"158","limonta 케미라 플랩 다운 자켓 dark brown","세미 와이드핏 롱 데님 팬츠_아이보리",NA,"tuxedo wool balmacaan coat (khaki)","릴렉스드 텐셀 린넨 셔츠 [화이트]",NA,NA,NA,NA,NA,NA,NA,NA,NA,"세미 와이드핏 롱 데님 팬츠_아이보리","캐시미어 블렌드 터틀 넥 니트 [다크 카멜]",NA,NA
"159","[nk] one 숏 패딩 자켓 (blk)(k201)","mnfs 542 와이드 데님팬츠 스톤그레이",NA,"melton wool balmacaan coat (khaki)","헤비웨이트 릴렉스드 크루 넥 긴팔 티셔츠 [블랙]",NA,NA,NA,NA,NA,NA,NA,NA,NA,"mnfs 542 와이드 데님팬츠 스톤그레이","캐시미어 블렌드 터틀 넥 니트 [아이보리]",NA,NA
"160","배색 스타디움 자켓 - 그린","델타 핏 데님 팬츠 (인디고)",NA,"overfit double breasted wool coat_check","울 셔츠 (올리브)",NA,NA,NA,NA,NA,NA,NA,NA,NA,"델타 핏 데님 팬츠 (인디고)","울 트위드 라운드 니트 멜란지 그레이",NA,NA
"161","코듀로이 벨벳 다운 자켓 다크 그레이","세미부츠컷 팬츠 (블랙)",NA,"double cloth over single peacoat black","[패키지] 매치오버핏 셔츠 4종 bjls4410",NA,NA,NA,NA,NA,NA,NA,NA,NA,"c.l. 데님 자켓_다크 블루","kn078_시티 그래픽 니트 스웨터_멜란지",NA,NA
"162","에센셜 1911 다운 자켓(fs2djd4101xcrm)","c.l. 데님 팬츠_다크 블루",NA,"wool blend balmacaan coat [black]","릴렉스드 텐셀 린넨 셔츠 [화이트]",NA,NA,NA,NA,NA,NA,NA,NA,NA,"c.l. 데님 팬츠_다크 블루","알파카 그라디언트 라운드 니트 블랙",NA,NA
"163","3m 신슐레이트 푸퍼 패딩 자켓 블랙","odpl 와이드 데님 팬츠 애쉬그레이",NA,"cashmere blended mac coat (dark beige)","(unisex) 마일드 베이지 셔츠",NA,NA,NA,NA,NA,NA,NA,NA,NA,"데님 럭색 - 블루","모헤어라운드니트 (아이보리)",NA,NA
"164","오리지널 스타일 푸퍼 숏다운자켓 md-x723","calik 슬림 크롭 데님 팬츠 [블랙]",NA,"cozy single wool coat_black","시티보이 빅오버 옥스포드 셔츠_off white",NA,NA,NA,NA,NA,NA,NA,NA,NA,"odpl 와이드 데님 팬츠 애쉬그레이","컨템포러리 울 하프 집업 니트 베이지 cooskt026beige",NA,NA
"165","리아 노카라 보아 자켓 (베이지)","워싱 와이드 밴딩팬츠 크림 kjlp2338",NA,"oversized double half coat navy","라이트웨이트 패널 스웨트셔츠 white",NA,NA,NA,NA,NA,NA,NA,NA,NA,"calik 슬림 크롭 데님 팬츠 [블랙]","기모 하프 폴라 니트 티셔츠 ivory",NA,NA
"166","그린페스타 코듀로이 패딩 자켓 navy","cp 306 워싱 테이퍼드핏 면팬츠 cr",NA,"nov basic double coat - light gray","폰테 터틀 넥 긴팔 티셔츠 [다크 그레이]",NA,NA,NA,NA,NA,NA,NA,NA,NA,"사이드 라인 블랙 워시드 데님","스트라이프 울 니트 스웨터",NA,NA
"167","클래식 레트로-x 자켓 23056-pebg","투 턱 와이드 플리츠 팬츠 [카키 브라운]",NA,"oversized double half coat beige","슬림핏 리넨 셔츠 - 화이트",NA,NA,NA,NA,NA,NA,NA,NA,NA,"스트레이트 크롭 데님_크림","레터링 앙고라 니트 (khaki)",NA,NA
"168","3m 신슐레이트 푸퍼 패딩 자켓 그레이쉬 블루","cone denim 벨티드 데님 팬츠 black",NA,"city cruiser coat (charcoal)","화이트 옥스포드 스트라이프 긴팔 셔츠_레귤러핏 (421864ly21)",NA,NA,NA,NA,NA,NA,NA,NA,NA,"cone denim 벨티드 데님 팬츠 black","토마스 모헤어 니트 [브라운]",NA,NA
"169","워싱 스티치 데님자켓 (black)","디지털 프린팅 루즈핏 팬츠 grey",NA,"[스탠다드]21fw oversized wide collar double coat black","솔리드 옥스포드 오버셔츠(화이트)",NA,NA,NA,NA,NA,NA,NA,NA,NA,"odpl 와이드 데님 팬츠 워시드블랙","캐시미어 100 크루 넥 니트 [미디엄 그레이]",NA,NA
"170","매그나니미티 후드 보아 자켓 black (ml4ju821-076)","odpl 와이드 데님 팬츠 워시드블랙",NA,"[스탠다드]21fw oversized wool crop double coat black","루즈핏 오픈카라 텐셀 린넨 셔츠 [모카 베이지]",NA,NA,NA,NA,NA,NA,NA,NA,NA,"슬림 크롭 데님 팬츠 [블랙]","캐시미어 블렌드 라운드 니트 미드그레이",NA,NA
"171","보아 스톰라이더 자켓 베이지","코튼 린넨 테이퍼드 이지 팬츠 [다크 네이비]",NA,"wool balance doub.coat (oatmeal)","수피마 코튼 롱 슬리브 티셔츠 (화이트)",NA,NA,NA,NA,NA,NA,NA,NA,NA,"kipas 슬림 크롭 데님 팬츠 [미디엄 인디고]","v126 하이넥 니트 가디건 (브라운)",NA,NA
