"","jacket","pants","padding","coat","shirt","sweatshirt","mentomen","pack","shorts","cap","socks","shoes","necklace","gardigan","jean","neat","jumper","tshirt"
"261","커버올 워크자켓 black","odpl 와이드 데님 팬츠 화이트",NA,NA,"린넨 코튼 릴렉스핏 오픈 카라 1/2 셔츠 블랙 coossh160black",NA,NA,NA,NA,NA,NA,NA,NA,NA,NA,"하프 터틀넥 니트 세트",NA,NA
"262","커버올 워크자켓 greige","루즈테이퍼드 팬츠 natural pu",NA,NA,"수피마 코튼 프리미엄 티셔츠 white",NA,NA,NA,NA,NA,NA,NA,NA,NA,NA,"소프트 울터치 무지 숏 미니 니트머플러3 (c2104-am095_bk)",NA,NA
"263","패딩 코치 자켓 black","세미부츠컷 팬츠 (화이트)",NA,NA,"미니멀 하프 셔츠 화이트",NA,NA,NA,NA,NA,NA,NA,NA,NA,NA,"하이넥짚업니트(모카베이지)",NA,NA
"264","워크 자켓 코듀로이 beige","m1978 시티보이 벌룬 와이드 팬츠 (카키)",NA,NA,"elf 프리미엄 실켓 티셔츠",NA,NA,NA,NA,NA,NA,NA,NA,NA,NA,"소프트 필링 세미오버 라운드 니트 그레이",NA,NA
"265","웨더 워크 자켓 purple","라이트웨이트 코튼 와이드 이지 팬츠 [베이지]",NA,NA,"릴렉스드 쇼트 슬리브 텐셀 린넨 셔츠 [네이비]",NA,NA,NA,NA,NA,NA,NA,NA,NA,NA,"유니섹스 플랙스 오버핏 골지 폴라 니트 블랙",NA,NA
"266","테크니트 스타디움 자켓 heather charcoal","쿨맥스 슬림 크롭 데님 팬츠 [미디엄 인디고]",NA,NA,"칼라리스 튜닉 셔츠 [화이트]",NA,NA,NA,NA,NA,NA,NA,NA,NA,NA,"알파카 오버핏 라운드 니트 그레이시 그린",NA,NA
"267","케이 플리스 자켓 black","pt1102 호크니팬츠-차콜",NA,NA,"릴렉스 핏 피케 폴로 셔츠 [블랙]",NA,NA,NA,NA,NA,NA,NA,NA,NA,NA,"[캐시미어 블렌디드] 블랙 니트 머플러 (291x84wy25)",NA,NA
"268","와펜 바시티 자켓 네이비","세미부츠컷 팬츠 (화이트)",NA,NA,"오픈 칼라 쇼트 슬리브 텐셀 린넨 셔츠 [라이트 베이지]",NA,NA,NA,NA,NA,NA,NA,NA,NA,NA,"캐시미어 슬릿 터틀넥 니트 (블랙)",NA,NA
"269","[캐시미어] 스타디움 자켓_gray","가먼트다잉 벨티드 데님 팬츠 black",NA,NA,"스트라이프 코튼 셔츠 2 color",NA,NA,NA,NA,NA,NA,NA,NA,NA,NA,"미니멀 크루 넥 니트 [더스티 블루]",NA,NA
"270","xj10 크링클 자켓 (beige)","가먼트다잉 벨티드 데님 팬츠 black",NA,NA,"크링클 하프셔츠 (화이트)",NA,NA,NA,NA,NA,NA,NA,NA,NA,NA,"램스울 리브드 터틀 넥 니트 [베이지]",NA,NA
"271","xj1 폰트 퍼 자켓 (black)","세미 벌룬팬츠 - 카키",NA,NA,"카라 집업 하프슬리브 셔츠 (블랙)",NA,NA,NA,NA,NA,NA,NA,NA,NA,NA,"m 그라데이션 니트 m gradation knit",NA,NA
"272","스테디 피시테일 자켓 블랙 jdot1320","테이퍼드핏 데님 팬츠 dp t908",NA,NA,"드레이프 우븐 티셔츠 charcoal",NA,NA,NA,NA,NA,NA,NA,NA,NA,NA,"오버핏 브러쉬 아가일 니트 스웨터 [그레이]",NA,NA
"273","차일드 플래그 플리스 자켓_오트밀","m1979_오케스트라 슬림 워시드 데님 팬츠",NA,NA,"솔리드 투포켓 오버핏 반팔 셔츠 (gray)",NA,NA,NA,NA,NA,NA,NA,NA,NA,NA,"소프트 베이직 터틀넥 니트 오트밀",NA,NA
"274","3m 신슐레이트 푸퍼 패딩 자켓 그레이쉬 블루","스카이 블루 턴업 레귤러핏 데님 팬츠 (421221lpaq)",NA,NA,"[패키지] 슬린 오버핏 반팔셔츠 2pack yhss2351",NA,NA,NA,NA,NA,NA,NA,NA,NA,NA,"폭스헤어 울 크루넥 니트 (카멜브라운)",NA,NA
"275","[비건 레더] 필드 자켓 블랙","레귤러 핏 데님 팬츠 [크림]",NA,NA,"크레용 스트라이프 셔츠 s81 라이트 라일락",NA,NA,NA,NA,NA,NA,NA,NA,NA,NA,"[니티드x깡스타일리스트] 소프트코튼 헤비 와플 니트 ivory",NA,NA
"276","[프리미엄] 램스킨 베지터블 싱글 자켓","스트레치 슬림핏 치노 팬츠 - 라이트 베이지",NA,NA,"네이비 포켓 디테일 셔츠",NA,NA,NA,NA,NA,NA,NA,NA,NA,NA,"화란 세미오버 니트 모카 베이지",NA,NA
"277","퍼스트 포켓  왁스 자켓 블랙","논스판 세미 와이드 데님 팬츠 [오프화이트]",NA,NA,"유니섹스 스마일 어스 엠보더리 티셔츠 atb524u(white)",NA,NA,NA,NA,NA,NA,NA,NA,NA,NA,"캐시미어 100 터틀 넥 니트 [미디엄 그레이]",NA,NA
"278","리버시블 플리스 집업 자켓 아이보리","와이드 벌룬 팬츠 라이트 카키",NA,NA,"모크넥 하프 스프라이프 니트 티셔츠 화이트",NA,NA,NA,NA,NA,NA,NA,NA,NA,NA,"램스울 크루넥 오버니트(헤더그레이)",NA,NA
"279","베이직 ma-1 셔링 자켓_카키","레플리카 퍼티그 팬츠 [베이지]",NA,NA,"릴렉스 핏 크루 넥 반팔 티셔츠 [더스티 그린]",NA,NA,NA,NA,NA,NA,NA,NA,NA,NA,"오버핏 브러쉬 아가일 니트 스웨터 [블랙]",NA,NA
"280","u마카롱후디자켓 cm","컴퍼트 와이드 테이퍼드 팬츠 네이비",NA,NA,"플레인 폴로 셔츠 [라이트 그레이]",NA,NA,NA,NA,NA,NA,NA,NA,NA,NA,"[니티드x깡스타일리스트] 소프트코튼 헤비 와플 니트 brown",NA,NA
"281","nj4fm50j 리모 플리스 자켓","st 팬츠 데님 one wash",NA,NA,"린넨 코튼 오픈카라 반팔 셔츠 [크림]",NA,NA,NA,NA,NA,NA,NA,NA,NA,NA,"반집업나그랑니트 (블랙)",NA,NA
"282","에센셜 다운 자켓 cream","레더 벨티드 필드 팬츠 (다크브라운)",NA,NA,"그래픽 하프 셔츠 블랙",NA,NA,NA,NA,NA,NA,NA,NA,NA,NA,"솔리드 케이블 오버니트(케럿)",NA,NA
"283","플리스 집업 자켓 베이지","데일리 퍼티그 팬츠_카키",NA,NA,"백프린트 로고 티셔츠 white",NA,NA,NA,NA,NA,NA,NA,NA,NA,NA,"소프트 코튼 크루넥 니트 빈티지브라운",NA,NA
"284","플리스 카라리스 자켓 블랙","더블 카고 체크 밴딩 팬츠 (green)",NA,NA,"파인 데이 박스셔츠_blue khaki",NA,NA,NA,NA,NA,NA,NA,NA,NA,NA,"타탄 체크 램스 울 니트 가디건 아이보리 cooscd012ivory",NA,NA
"285","플리스 집업 자켓 아이보리","[eu] 밴딩 스트레이트 팬츠 (dark beige) ckpa0f745i3",NA,NA,"린넨 코튼 오픈카라 반팔 셔츠 [크림]",NA,NA,NA,NA,NA,NA,NA,NA,NA,NA,"오버핏 브러쉬 아가일 니트 스웨터 [아이보리]",NA,NA
"286","플리스 집업 자켓 블랙","와이드 코듀로이 팬츠(브라운)",NA,NA,"트로피컬 투포켓 셔츠 grey",NA,NA,NA,NA,NA,NA,NA,NA,NA,NA,"울 모헤어 빅오버핏 니트 [브라운]",NA,NA
"287","플리스 카라리스 자켓 아이보리","델타 핏 데님 팬츠 (크림)",NA,NA,"프린트 숏 슬리브 셔츠 black",NA,NA,NA,NA,NA,NA,NA,NA,NA,NA,"브러쉬드 스트라이프 니트_그레이쉬 블루",NA,NA
"288","플리스 집업 자켓 퍼플","투턱 팬츠(그레이)",NA,NA,"미니멀 카라 린넨 풀오버 셔츠 [navy]",NA,NA,NA,NA,NA,NA,NA,NA,NA,NA,"sw1403 램스울 라운드 니트-피칸",NA,NA
"289","sp 보아 데님 트러커 자켓-블루","와이드 플레어 베이지 울 팬츠",NA,NA,"린넨 히든 미니멀 셔츠 [sky blue]",NA,NA,NA,NA,NA,NA,NA,NA,NA,NA,"메리노울 오버핏 라운드니트_캐럿",NA,NA
"290","레트로 클래식 레빈 보아 플리스 집업자켓 beige_fl4kf01u","iise x dpr 팬츠 - 블랙 / dpr-0401a",NA,NA,"오픈 칼라 쇼트 슬리브 텐셀 린넨 셔츠 [네이비]",NA,NA,NA,NA,NA,NA,NA,NA,NA,NA,"소프트  램스울  니트 베스트_모카",NA,NA
"291","[에코레더] 스타디움 자켓_021","레더 4지퍼 본디지 팬츠",NA,NA,"[green beanpole] 그린 1도 스트라이프 티셔츠 (bc1342n05m)",NA,NA,NA,NA,NA,NA,NA,NA,NA,NA,"오버핏 벌룬 크루넥 니트 (크림)",NA,NA
"292","플리스 카라리스 자켓 멜란지 그레이","코듀로이 테이퍼드핏 팬츠 블랙",NA,NA,"크링클 미드-슬리브 셔츠 in 화이트",NA,NA,NA,NA,NA,NA,NA,NA,NA,NA,"크루넥 리브 니트 스웨터_블랙",NA,NA
"293","보아 하이넥 집업 자켓 아이보리","v289 인디고 롤업 데님 팬츠-(블루)",NA,NA,"수피마 코튼 세미오버핏 티셔츠 (더스티그린)",NA,NA,NA,NA,NA,NA,NA,NA,NA,NA,"하프 폴라 니트 티셔츠 오프화이트",NA,NA
"294","피치스킨 트윌 자켓 카멜","레귤러 핏 데님 팬츠 [크림]",NA,NA,"레이스 피케 반팔 셔츠 (아이보리)",NA,NA,NA,NA,NA,NA,NA,NA,NA,NA,"하프 폴라 니트 티셔츠 블랙",NA,NA
"295","카우 스웨이드 스타디움 숏 자켓","린넨 포텐셜 와이드 팬츠 cp751nv",NA,NA,"유니섹스 스마일 어스 엠보더리 티셔츠 atb524u(white)",NA,NA,NA,NA,NA,NA,NA,NA,NA,NA,"미니멀 크루 넥 니트 [크림]",NA,NA
"296","3m 신슐레이트 보아 플리스 무톤 자켓 블랙","이지 와이드 밴딩 팬츠 grey beige",NA,NA,"유니섹스 스마일 어스 엠보더리 티셔츠 atb524u(white)",NA,NA,NA,NA,NA,NA,NA,NA,NA,NA,"캐시미어 블렌드 모크 넥 니트 [미디엄 그레이]",NA,NA
"297","리버시블 플리스 집업 자켓 아이보리","벨티드 플리티드 팬츠 grey beige",NA,NA,"유니섹스 스마일 어스 엠보더리 티셔츠 atb524u(white)",NA,NA,NA,NA,NA,NA,NA,NA,NA,NA,"스트라이프 부클 오버 니트(브라운)",NA,NA
"298","유틸리티 쉘 파카 자켓 (khaki)","[스탠다드]22ss wide fit deep pleats cotton pants charcoal",NA,NA,"오버핏라운드셔츠_체크",NA,NA,NA,NA,NA,NA,NA,NA,NA,NA,"모헤어 울 니트 / 그레이",NA,NA
"299","차일드 플래그 플리스 자켓_오트밀","pleated wide pants (black)",NA,NA,"미니멀 실키 티셔츠 [크림]",NA,NA,NA,NA,NA,NA,NA,NA,NA,NA,"[처비] 램스울 실루엣 라인 니트 브라운",NA,NA
"300","2-way 유틸리티 ma-1 자켓_블랙","fair belted raw denim pants black",NA,NA,"오픈카라 반팔셔츠 (네이비)",NA,NA,NA,NA,NA,NA,NA,NA,NA,NA,"부클 리버스 스페이스 다잉 니트_아이스블루",NA,NA
"301","트러커 5106 하이넥 후디 오버핏 미디움인디고 데님자켓","[오리지널스]22ss comfy carpenter selvage denim pants indigo",NA,NA,"남 j320771 beh 블랙 슬림핏 ck 뱃지 폴로 반팔 티셔츠",NA,NA,NA,NA,NA,NA,NA,NA,NA,NA,"[2pack] 모크 터틀넥 니트 세트",NA,NA
"302","limonta 케미라 플랩 다운 자켓 dim grey","compact yarn carrot-fit pants - ivory",NA,NA,"남 j317422 chw 네이비 린넨 반팔 셔츠",NA,NA,NA,NA,NA,NA,NA,NA,NA,NA,"그레이 오버핏 크롭 집업 하프넥 니트 iesw1f003g2",NA,NA
"303","bel&co 수피마 구스 다운 자켓 ash beige","third edition denim pants (light blue)",NA,NA,"스탠카라풀오버오버핏반팔셔츠 mvws3111",NA,NA,NA,NA,NA,NA,NA,NA,NA,NA,"sw1403 램스울 라운드 니트-그린모스",NA,NA
"304","버킷리스트 a1 자켓_ms","pleated wide pants (black)",NA,NA,"릴렉스드 쇼트 슬리브 셔츠 [더스티 블루]",NA,NA,NA,NA,NA,NA,NA,NA,NA,NA,"플로럴 펀칭 니트 (블랙)",NA,NA
"305","배색 스타디움 자켓 - 그린","wave denim pants (charcoal)",NA,NA,"[bcycle] [regular] 화이트 헨리넥 티핑 피케 티셔츠 (bc1342c221)",NA,NA,NA,NA,NA,NA,NA,NA,NA,NA,"브러쉬 스트라이프 니트_블랙/화이트",NA,NA
"306","베이직 스타디움 자켓 - 네이비","one tuck chino pants beige",NA,NA,"21ss ms 브이넥 셔츠 - 블랙",NA,NA,NA,NA,NA,NA,NA,NA,NA,NA,"캐시미어혼방카라니트 lvkt7101",NA,NA
"307","램스킨 오버핏 싱글 자켓","cotton blend wide pants_beige",NA,NA,"라츠 그래픽 티셔츠 버터 아이보리",NA,NA,NA,NA,NA,NA,NA,NA,NA,NA,"벌키 브러쉬 아가일 니트 black",NA,NA
"308","뉴잉 오버핏 바람막이 자켓 (그린)","[스탠다드]22ss wide fit deep pleats cotton pants black",NA,NA,"스퀘어 풀오버 셔츠",NA,NA,NA,NA,NA,NA,NA,NA,NA,NA,"[세트]  하프 폴라 니트 티셔츠",NA,NA
"309","e 플리스 자켓 베이지","208 semi wide pants [ash brown]",NA,NA,"22s/s 오버핏 피케티셔츠 (라이트카키)",NA,NA,NA,NA,NA,NA,NA,NA,NA,NA,"램스울 브이 넥 니트 베스트 [미디엄 그레이]",NA,NA
"310","하이넥자켓(크림)","belted wide cotton pants grey beige",NA,NA,"수피마 릴렉스드 크루 넥 긴팔 티셔츠 [더스티 카키]",NA,NA,NA,NA,NA,NA,NA,NA,NA,NA,"프리미엄 울 블렌디드 세미 오버 니트 (black)",NA,NA
"311","후디데님자켓(블랙)","[스탠다드]twisted seam denim pants_black",NA,NA,"릴렉스 핏 실키 셔츠 [그레이쉬 블루]",NA,NA,NA,NA,NA,NA,NA,NA,NA,NA,"믹스드 크루넥 니트 [데저트 라임]",NA,NA
"312","m-51 숏 필드 자켓_카키","viscose stitch cotton pants_black",NA,NA,"(unisex) 스탠다드 스트라이프 셔츠_그레이",NA,NA,NA,NA,NA,NA,NA,NA,NA,NA,"미니멀리스트 루즈핏 니트 [포레스트]",NA,NA
"313","코듀로이 퍼티그 블레이저 자켓 올리브","[스탠다드]22ss straight fit fatigue denim pants light beige",NA,NA,"베이직데님셔츠",NA,NA,NA,NA,NA,NA,NA,NA,NA,NA,"부클 리버스 스페이스 다잉 니트_아이스블루",NA,NA
"314","모디파이 2way 오버핏 ma-1 자켓_silver gray","basic chino pants black",NA,NA,"쿨텐션 슬릿넥 반팔 티셔츠_epb2tr1361wt",NA,NA,NA,NA,NA,NA,NA,NA,NA,NA,"[니티드 x 5252바이오아이오아이] 벌키 브러쉬 아가일 니트 purple",NA,NA
"315","뉴잉 오버핏 바람막이 자켓 (그레이)","wide officer pants beige",NA,NA,"21ss ms 오버사이즈 페이즐리 셔츠 - 베이지",NA,NA,NA,NA,NA,NA,NA,NA,NA,NA,"캐시미어 블렌드 라운드 니트 네이비",NA,NA
"316","클라우드 플리스 자켓_블랙","comfort denim pants one washed",NA,NA,"헨리넥 7부 스트라이프 셔츠_m194msh952m",NA,NA,NA,NA,NA,NA,NA,NA,NA,NA,"[드로우핏x깡스타일리스트] 터틀넥 니트 티셔츠 set",NA,NA
"317","chmps 바람막이 자켓 set-up 네이비","classic news boy pants_grey",NA,NA,"클래식 체크 셔츠_오트밀",NA,NA,NA,NA,NA,NA,NA,NA,NA,NA,"미니멀 울 반목폴라 니트 [브라운]",NA,NA
"318","클린 로우 컷 넥 집 데님 자켓_블루","belted wide cotton pants grey beige",NA,NA,"로고 티 셔츠 knt003m(white)",NA,NA,NA,NA,NA,NA,NA,NA,NA,NA,"램스울 피셔맨 니트 아이보리",NA,NA
"319","m65 숏 자켓 올리브","belted wide cotton pants brown",NA,NA,"린넨 텐셀 셔츠 블랙",NA,NA,NA,NA,NA,NA,NA,NA,NA,NA,"sw1409 세르쥬 니트베스트-카키트리",NA,NA
"320","와펜 바시티 자켓 네이비","first edition denim pants (black)",NA,NA,"라이트 그레이 히든 버튼 헨리넥 반소매 티셔츠 (211342by22)",NA,NA,NA,NA,NA,NA,NA,NA,NA,NA,"미니멀 브이 넥 니트 [베이지]",NA,NA
"321","보아 집업 자켓 아이보리","[스탠다드]21fw regular fit white stitch denim pants black",NA,NA,"오버사이즈 히든 미니멀 셔츠 [white]",NA,NA,NA,NA,NA,NA,NA,NA,NA,NA,"캐시미어 블렌드 리브드 크루 넥 니트 [다크 카멜]",NA,NA
"322","3m 신슐레이트 바시티 자켓 네이비","[스탠다드]21fw corduroy one tuck curved pants olive",NA,NA,"오버사이즈 워싱 코튼 셔츠 화이트",NA,NA,NA,NA,NA,NA,NA,NA,NA,NA,"미니멀 크루 넥 니트 [아보카도]",NA,NA
"323","베이직 스타디움 자켓 - 네이비","plaid jacquard wide pants (black)",NA,NA,"오버사이즈 리넨 그레이엄 체크 셔츠 그레이쉬 퍼플",NA,NA,NA,NA,NA,NA,NA,NA,NA,NA,"시아 칼라 니트(연브라운)",NA,NA
"324","[블랙 워치] 코드 후드 집업 자켓","third edition denim pants (light blue)",NA,NA,"이지 케어 린넨 라이크 셔츠 화이트",NA,NA,NA,NA,NA,NA,NA,NA,NA,NA,"소프트 텐센 무지 브이넥 니트_logue10_05",NA,NA
"325","reve ⅱ (리브 2) 남녀공용 플리스 리버시블 다운 자켓_cream","natural cream wide pants cream",NA,NA,"오버 핏 크루 넥 티셔츠 - 화이트",NA,NA,NA,NA,NA,NA,NA,NA,NA,NA,"모크넥 니트 브라운",NA,NA
"326","후드 데님 셔츠 자켓 -흑청","[스탠다드]21fw wide fit string warm pants black",NA,NA,"x kirin psycho 반팔 티셔츠 white",NA,NA,NA,NA,NA,NA,NA,NA,NA,NA,"sw1409 세르쥬 니트베스트-오트레드",NA,NA
"327","데님 트러커 자켓 오프 화이트","clean denim 4 pleats pants [black]",NA,NA,"오버사이즈 워싱 코튼 셔츠 화이트",NA,NA,NA,NA,NA,NA,NA,NA,NA,NA,"소프트 필링 세미오버 라운드 니트 초코브라운",NA,NA
"328","코드 후드 집업 자켓 블랙","loose fit chino pants ka [brown]",NA,NA,"오버사이즈 셔츠 재킷 [더스티 블루]",NA,NA,NA,NA,NA,NA,NA,NA,NA,NA,"소프트코튼 드랍숄더 오버핏 와플 니트 oatmeal",NA,NA
"329","울 바시티 자켓 (화이트라인)","wide slacks pants black",NA,NA,"크루 넥 긴팔 티셔츠 [화이트]",NA,NA,NA,NA,NA,NA,NA,NA,NA,NA,"cb 스퀘어 니트 (카키베이지)",NA,NA
"330","[비건스웨이드] 크루얼티프리 알파 스웨이드 자켓 iro097 블랙","pleated wide pants (black)",NA,NA,"스트라이프 보트 넥 긴팔 티셔츠 [아이보리/네이비]",NA,NA,NA,NA,NA,NA,NA,NA,NA,NA,"캐시미어 블렌드 터틀 넥 니트 [아보카도]",NA,NA
"331","c.l. 데님 자켓_다크 블루","wide slacks pants grey",NA,NA,"코티드 코튼 셔츠 black",NA,NA,NA,NA,NA,NA,NA,NA,NA,NA,"램스울 브이 넥 니트 베스트 [모카]",NA,NA
"332","행오버 데님 자켓 - 데님","[스탠다드]twisted seam denim pants_ivory",NA,NA,"프린트 숏 슬리브 셔츠 beige",NA,NA,NA,NA,NA,NA,NA,NA,NA,NA,"홀가먼트 라운드 니트 beige",NA,NA
"333","m1776 세미오버핏 워시드 데님 자켓","fatigue wool pants dark brown",NA,NA,"유니섹스 커트 아트웍 티셔츠 atb596u(white)",NA,NA,NA,NA,NA,NA,NA,NA,NA,NA,"소프트 필링 세미오버 라운드 니트 초코브라운",NA,NA
"334","코튼 마운틴 자켓 베이지","stitch denim pants indigo",NA,NA,"옥스포드 베이직 셔츠 화이트",NA,NA,NA,NA,NA,NA,NA,NA,NA,NA,"워셔블 라운드 니트_zpb1er1301bl",NA,NA
"335","리버시블 플리스 카라리스 자켓 아이보리","belted wide cotton pants grey beige",NA,NA,"화이트 스트라이프 포인트 셔츠 (211364ayf1)",NA,NA,NA,NA,NA,NA,NA,NA,NA,NA,"[패키지] 시티보이 브이넥 니트베스트",NA,NA
"336","하이그로시 하이넥 플라켓 자켓 - 올리브","[스탠다드]twisted seam denim pants_black",NA,NA,"오버사이즈 글렌체크 셔츠.",NA,NA,NA,NA,NA,NA,NA,NA,NA,NA,"램스울 크루넥 오버니트(오트밀)",NA,NA
"337","차콜그레이 오버핏 4포켓 워크 집업 자켓","melange beige wide belted pants tnpa1f710i2",NA,NA,"데미지 워시드 테일 데님 셔츠_블루",NA,NA,NA,NA,NA,NA,NA,NA,NA,NA,"소프트 코튼 크루넥 니트 빈티지브라운",NA,NA
"338","플리스 보머 자켓_블랙","belted wide cotton pants grey beige",NA,NA,"에센셜 옥스포드 셔츠 essential oxford shirts",NA,NA,NA,NA,NA,NA,NA,NA,NA,NA,"캐시미어 블렌드 니트 베스트 미드그레이",NA,NA
"339","디테처블 트러커 자켓 (람포 지퍼)","first edition denim pants (black)",NA,NA,"이지 케어 린넨 라이크 셔츠 오트밀",NA,NA,NA,NA,NA,NA,NA,NA,NA,NA,"캐시미어 블렌드 라운드 니트 네이비",NA,NA
"340","스톤워싱 헤비 트러커 자켓 베이지","[스탠다드]21fw wide fit string warm pants beige",NA,NA,"노맨틱 네오 타탄 체크 셔츠 네이비",NA,NA,NA,NA,NA,NA,NA,NA,NA,NA,"sw1409 세르쥬 니트베스트-카키트리",NA,NA
"341","grid (그리드) 남녀공용 플리스 자켓_white","209 one tuck wide banding pants [khaki beige]",NA,NA,"썸머 파자마 오버핏 셔츠 화이트",NA,NA,NA,NA,NA,NA,NA,NA,NA,NA,"램스울 피셔맨 니트 아이보리",NA,NA
"342","플리스 보머 자켓_오트밀","cotton fatigue pants regular fit natural",NA,NA,"베이식 긴팔 티셔츠 [더스티 그린]",NA,NA,NA,NA,NA,NA,NA,NA,NA,NA,"미니멀 모크 넥 니트 [크림]",NA,NA
"343","다크블루 오버핏 데님 초어 자켓","one-tuck cinch back chino pants beige",NA,NA,"클래식 화이트 셔츠 s40",NA,NA,NA,NA,NA,NA,NA,NA,NA,NA,"에이씨 소프트 니트 베스트 라이트그레이",NA,NA
"344","리버시블 플리스 카라리스 자켓 세이지그린","209 one tuck wide banding pants [khaki beige]",NA,NA,"빈티지 블랙 도트 스트라이프 셔츠 s22",NA,NA,NA,NA,NA,NA,NA,NA,NA,NA,"미니멀 울 반목폴라 니트 [브라운]",NA,NA
"345","마타와 셰르파 플리스 자켓 khaki_fl4kf13u","[오리지널스]wide fit gurkha selvage denim pants black",NA,NA,"릴렉스드 긴팔 티셔츠 [화이트]",NA,NA,NA,NA,NA,NA,NA,NA,NA,NA,"캐시미어 블렌드 라운드 니트 네이비",NA,NA
"346","사바하 코치 자켓","wide damage denim pants black",NA,NA,"빅 포니 스웨트셔츠 - 그레이",NA,NA,NA,NA,NA,NA,NA,NA,NA,NA,"오버핏 네츄럴 레글런 니트-아이보리",NA,NA
"347","버킷리스트 a1 자켓_bg","blast destroyed denim pants",NA,NA,"커스텀핏 포플린 셔츠 - 화이트",NA,NA,NA,NA,NA,NA,NA,NA,NA,NA,"이비자_네츄럴 메시드니트_네츄럴 그린",NA,NA
"348","2nd 데님 자켓 (인디고)","one-tuck cinch back chino pants beige",NA,NA,"오버핏 레이어드 롱티셔츠 아이보리 kjlt2153",NA,NA,NA,NA,NA,NA,NA,NA,NA,NA,"탑필 캐시미어 라운드 니트 (그레이시더스티그린)",NA,NA
"349","e 플리스 자켓 베이지","cotton blend wide pants_brown",NA,NA,"베이직 옥스포드 버튼 다운 셔츠_화이트",NA,NA,NA,NA,NA,NA,NA,NA,NA,NA,"[세트]  하프 폴라 니트 티셔츠",NA,NA
"350","후드 집업 자켓 그레이","chino pants (dark navy)",NA,NA,"wsk 스트라이프 코튼 럭비 티셔츠 - 그린 x 네이비",NA,NA,NA,NA,NA,NA,NA,NA,NA,NA,"램스울 리브드 브이 넥 니트 [머쉬룸]",NA,NA
"351","2-way 유틸리티 ma-1 자켓_그레이","canaby street check pants_beige",NA,NA,"커스텀핏 옥스포드 셔츠 - 화이트",NA,NA,NA,NA,NA,NA,NA,NA,NA,NA,"캐시미어 100 터틀 넥 니트 [아이보리]",NA,NA
"352","차일드 후드 플리스 자켓_블랙","modoo pants daily 모두바지 데일리(navy)",NA,NA,"듀라빌리티 롱 슬리브 티셔츠 [오프화이트]",NA,NA,NA,NA,NA,NA,NA,NA,NA,NA,"램스울 리브드 터틀 넥 니트 [미드나잇 블루]",NA,NA
"353","c.l. 데님 자켓_올드 쿠퍼","bill comfort fatigue pants tan",NA,NA,"베이직 레이어드 티셔츠 [블랙/아이보리]",NA,NA,NA,NA,NA,NA,NA,NA,NA,NA,"램스울 크루넥 오버니트(그레이)",NA,NA
"354","베이직 스타디움 자켓 - 블랙","pleats wide pants beige",NA,NA,"릴렉스 핏 코듀로이 셔츠 [화이트]",NA,NA,NA,NA,NA,NA,NA,NA,NA,NA,"탑필 캐시미어 라운드 니트 (미드나잇블루)",NA,NA
"355","워싱 스티치 데님자켓 (indigo)","203 solid silhouette wide pants [black]",NA,NA,"터틀 하이 벤트 레이어드 티셔츠 [black]",NA,NA,NA,NA,NA,NA,NA,NA,NA,NA,"[men collection] 라이드 메리노 터틀넥 니트 2008298613100007",NA,NA
"356","[set] ykk 2-way 테크 숏 자켓 셋업_베이지","[stsd] easy fatigue pants (sjybspt106_nt)",NA,NA,"미니멀 tr 히든 셔츠_화이트",NA,NA,NA,NA,NA,NA,NA,NA,NA,NA,"[men collection] 라이드 메리노 터틀넥 니트 2008298609010009",NA,NA
"357","리버시블 플리스 카라리스 자켓 아이보리","pleats wide pants black",NA,NA,"히든 버튼 드레스 셔츠 [화이트]",NA,NA,NA,NA,NA,NA,NA,NA,NA,NA,"알파카 오버핏 라운드 니트 희끗 네이비",NA,NA
"358","코튼 트러커 자켓 (블랙)","203 solid silhouette wide pants [black]",NA,NA,"2012 롱슬리브 티셔츠 화이트",NA,NA,NA,NA,NA,NA,NA,NA,NA,NA,"헤어리 브러쉬 라운드 니트 beige",NA,NA
"359","투포켓 데님 자켓 (크림)","pleats wide pants black",NA,NA,"에스엠씨오씨엘 케이.오버사이즈 스웻 셔츠 블랙",NA,NA,NA,NA,NA,NA,NA,NA,NA,NA,"하프 터틀넥 니트 세트",NA,NA
"360","재규어 오버핏 스타디움 바시티 패딩 자켓(베이지)","daily linen banding pants(ivory)",NA,NA,"스트라이프 이지 셔츠 (화이트)",NA,NA,NA,NA,NA,NA,NA,NA,NA,NA,"쿨 소프트 롱 슬리브 크루넥 니트 오트밀",NA,NA
"361","오버사이즈 중청 데님 트러커 자켓","203 solid silhouette wide pants [brown]",NA,NA,"v040 오버핏 롱 셔츠 (화이트)",NA,NA,NA,NA,NA,NA,NA,NA,NA,NA,"[울캐시 70/30]브라운 에센셜 세미오버핏 캐시미어 라운드 니트",NA,NA
"362","390 지퍼 데님 자켓 클라우드","wide slacks pants black",NA,NA,"u로고 프레피 코튼셔츠_내추럴",NA,NA,NA,NA,NA,NA,NA,NA,NA,NA,"미니멀 울 반목폴라 니트 [블랙]",NA,NA
"363","플리스 웜 집업 자켓 / 아이보리","crop wide pants white",NA,NA,"화이트 옥스포드 세미오버 셔츠",NA,NA,NA,NA,NA,NA,NA,NA,NA,NA,"알파카 오버핏 라운드 니트 쿨 그레이",NA,NA
"364","리치 오버 ma-1 자켓 카키 yhjk2269","pleats wide pants black",NA,NA,"브러시드 세미오버핏 체크 셔츠_bza4wc1101cpk",NA,NA,NA,NA,NA,NA,NA,NA,NA,NA,"소프트코튼 드랍숄더 오버핏 와플 니트 oatmeal",NA,NA
"365","시티 바시티 자켓 -네이비-","2 tuck c wide pants (light beige)",NA,NA,"로고 와펜 피그먼트 스웻셔츠_옐로우(ik2afmm443a)",NA,NA,NA,NA,NA,NA,NA,NA,NA,NA,"램스울 리브드 브이 넥 니트 [머쉬룸]",NA,NA
"366","오버핏 데님 자켓 (연청)","[스탠다드]21ss wide fit tr one tuck pants grey",NA,NA,"하프넥 롱슬리브 티셔츠 (ivory)",NA,NA,NA,NA,NA,NA,NA,NA,NA,NA,"v094 부클 라운드 니트 (크림)",NA,NA
"367","가먼트다잉 투포켓 데님 자켓 light beige","classic boxer short pants black",NA,NA,"eyes 패턴 슬림핏 셔츠 f75 5ch200 1fm 01",NA,NA,NA,NA,NA,NA,NA,NA,NA,NA,"20f/w 울 터틀넥 니트 (베이지)",NA,NA
"368","컨템포러리 크롭 데님 자켓 블루","203 solid silhouette wide pants [brown]",NA,NA,"헤링본 클래식 체크 셔츠 s41",NA,NA,NA,NA,NA,NA,NA,NA,NA,NA,"화란 세미오버 니트 크림",NA,NA
"369","1617 더 플레이어 스타디움 자켓 버건디","modoo pants 모두바지(beige)",NA,NA,"오버사이즈 글렌체크 셔츠.",NA,NA,NA,NA,NA,NA,NA,NA,NA,NA,"쿨 소프트 롱 슬리브 카라 니트 빈티지브라운",NA,NA
