"","jacket","pants","padding","coat","shirt","sweatshirt","mentomen","pack","shorts","cap","socks","shoes","necklace","gardigan","jean","neat","jumper","tshirt"
"1","컴피 워셔 후드 숏 자켓_차콜","[사은품 증정]데님 팬츠 h1 #004 세미 와이드 핏 청바지 화이트 dcpth1004white","램스킨 다운 푸퍼 숏 패딩 재킷","레더 코트 스니커즈 [화이트]","크링클 미드-슬리브 셔츠 in 화이트","사이드 립 하프 집업 스웻셔츠 (브라운)","헤비 코튼 오버 럭비 맨투맨 _midnight blue","레이어드 크루 넥 반팔 티셔츠_일반 기장 2팩","벨티드 와이드 쇼츠 belted wide shorts","(cotton) watch cap [black]","아가일 블루 패션양말","5cm 모던 유니섹스 스니커즈 에센셜(cl0032)","s.s 체인 목걸이 04 (써지컬스틸 사각바 펜던트 목걸이)","파로 오버 사이즈 부클 가디건 세이지 그린","와이드 데님 팬츠 (블랙)","펀칭 라운드 긴팔 니트 [민트]","[비건레더] 크루얼티프리 카라넥 ma-1 레더 점퍼 iro112 아이보리","레이어드 크루 넥 반팔 티셔츠_일반 기장 2팩"
"2","[set] 테크 워셔 절개 자켓 셋업_베이지","modoo pants daily 모두바지 데일리(navy)","오버사이즈 덕다운 포켓 푸퍼 패딩아우터 점퍼_black","코트_오프 화이트","드레이프 오픈 칼라 셔츠 grey beige","로고 와펜 피그먼트 스웻셔츠_옐로우(ik2afmm443a)","비스코스 니트 맨투맨 ivory","글로스 미니멀 백팩_블랙","[오리지널스]21ss comfy cotton gurkha shorts beige","lc basic hunting cap (navy)","헤르츠 스트라이프 양말","3cm 소가죽 독일군 스니커즈 베일리(cr0012)","s.s 체인 목걸이 04 (써지컬스틸 사각바 펜던트 목걸이)","믹스 버튼 카라 가디건_라이트 옐로우","와이드 데님 하프 팬츠 cm","xtk016 대퍼딜 꽈배기 니트 (khaki)","오버사이즈 덕다운 포켓 푸퍼 패딩아우터 점퍼_black","베이식 긴팔 티셔츠 [화이트]"
"3","코듀로이 바시티 자켓 네이비","modoo pants 모두바지(beige)","소프트 히트 패딩 점퍼 그레이","코트_오프 화이트","레이어드 크루 넥 반팔 티셔츠_일반 기장 2팩","cwss-2001 컷앤쏘잉 컬렉션 밀리터리 투톤 헤비 스웻셔츠 버건디","캔자스 트리 리버스위브 기모 맨투맨 네이비","컴팩트 스퀘어 메탈 tq34 swh 37mm","hidden banding linen shorts - black","bs wool hunting cap (black)",NA,"5cm 유니섹스 독일군 스니커즈 제너럴(cl0035)","[rushoff] benedictus ring necklace /베네딕토 링 목걸이(925 은도금)","오버핏 크롭 카라 가디건 [베이지]","카이엔_원 턱 테일러드 벨티드 데님_소피아 브라운","파이어맨 니트 풀오버 (skyblue)","소프트 히트 패딩 점퍼 그레이","실켓 코튼 로고 티셔츠(white)(just-1)"
"4","91b 블루종 자켓 블랙","modoo pants 모두바지(ivory)","3m 신슐레이트 버핑 레더 패딩 블랙","스코트 47 애쉬 그레이 베이지","베이식 긴팔 티셔츠 [화이트]","aeca collar sweatshirt-light grey","에센셜 오버핏 맨투맨 블랙","3웨이 유즈 폴리건 백팩 [그레이]","seersucker stripe easy shorts (navy)","ht check hunting cap (light grey)",NA,"ht4741 6cm 커플 키높이 독일군 스니커즈 하인츠 화이트 [230~280mm]","희망을 주는 데이지팬던트 써지컬스틸 목걸이 (c2101-an703_sv)","카라 가디건 (파우더 베이지)","원턱데님팬츠 (라이트그레이)","이비자 네츄럴 메시드 니트 그레이 라벤더","[비건레더] 크루얼티프리 카라넥 ma-1 레더 점퍼 iro112 블랙","릴렉스 핏 크루 넥 반팔 티셔츠 [화이트]"
"5","[set] ykk 2-way 테크 숏 자켓 셋업_차콜","와이드 데님 팬츠 (블랙)","오리엔탈 패딩 두루마기 가디건","레더 코트 스니커즈 [화이트]","오픈 칼라 폴로 셔츠 [화이트]","c.r.e.a.m overfit sweatshirt (black)",NA,"남자 노트북백팩 lo-1816 dbr","8s linen gurkha shorts (khaki)","pl tweed hunting cap (slate grey)",NA,"wtrd3104 시몬 오리진 독일군 스니커즈 그레이 [230~290mm]","con-001 (j) 써지컬 스틸 이니셜 목걸이","린넨 레이어드 풀오버 가디건 니트 (블랙)","쉐인 와이드 데님 팬츠","오버핏 스트링 니트 베스트 (모카베이지)","레귤러 rgl 2way ma-1 항공점퍼  gun metal","쿨탠다드 릴렉스 핏 크루 넥 반팔 티셔츠 [화이트]"
"6","g.h.c 스타디움 자켓_네이비","와이드 데님 하프 팬츠 cm","자수 퀄팅 패딩 복조리 크로스백","그랜드 크로스코트 스니커즈 white","실켓 코튼 로고 티셔츠(white)(just-1)","(기모) nyc location sweatshirt (mint) [lrpwctm304mmia]",NA,"[스탠다드x오에이엠팩토리]21fw oversized wool maxi coat light beige",NA,"new stickcap color mix orange mix",NA,"남성 슈퍼스타 골드 탭 골드 스타 스니커즈 - 화이트:골드 스파클 / gmf00101f00031610272","stj-sn2003 트위스티드 목걸이","파로 오버 사이즈 부클 가디건 루센트 아이보리","로프 와이드 더블 데님 팬츠","소프트 스탠다드 데일리니트_그린","[rds인증] 카키 bt4 3 way 구스 다운 점퍼 (bc1x38c74h)","심볼 반팔 티셔츠 (그레이)"
"7","미니멀 소프트 울 자켓 [melange beige]","원턱데님팬츠 (라이트그레이)","아웃 포켓 다운 숏 패딩 재킷 [웜 그레이]","오버사이즈 트렌치 코트 sand brown","시티보이 빅오버 옥스포드 셔츠_sky blue stripe","c.r.e.a.m overfit sweatshirt (black)",NA,"[스탠다드x오에이엠팩토리]21fw oversized wool maxi coat black",NA,"glen check flat cap (grey)",NA,"5in og - 오리지널 독일군 스니커즈","stj-sn2001 로고 스틱 목걸이","퍼스 라쿤 칼라 셔츠 가디건 하이랜드 그린","kipas 스트레이트 데님 팬츠 [라이트 인디고]","워셔블 하찌 니트 - 10 color","rds숏다운점퍼_gr lvdj7101","수피마 코튼 세미오버핏 티셔츠 (화이트)"
"8","sp 나일론 바시티 자켓-블랙","[사은품 증정]솔리드 코튼 투 턱 와이드 팬츠 dcpt007ivory","[비건레더] 크루얼티프리 하이넥 레더 숏패딩 iro116 블랙","레더 코트 스니커즈 [화이트]","릴렉스 핏 크루 넥 반팔 티셔츠 [화이트]",NA,NA,"lomita hq 가죽 노트북 백팩",NA,"glen check flat cap (grey)",NA,"남성 슈퍼스타 블랙 탭 아이스 스타 스니커즈 - 화이트:블랙 / gmf00102f00031810220","stj-sn2003 트위스티드 목걸이","베이직 니트 가디건_모카","콘트라스트 스티치 레귤러 핏 데님 팬츠 [크림]","이탈리안 코튼 폴로 니트 off white","오버사이즈 덕다운 포켓 푸퍼 패딩아우터 점퍼_black","wild 수피마 티셔츠"
"9","ykk 2-way 테크 숏 자켓_블랙","쉐인 와이드 데님 팬츠","오버사이즈 덕다운 포켓 푸퍼 패딩아우터 점퍼_black","코튼 오버사이즈 맥 코트 [크림]","솔리드 옥스포드 오버셔츠(화이트)",NA,NA,"남자시계 fc-710mc4h4 매뉴팩처 클래식",NA,"beige big check newsboy cap 뉴스보이캡",NA,"레더 코트 스니커즈 [화이트]","페인트 팔레트 목걸이 - 매트 그레이","파로 오버 사이즈 부클 가디건 세이지 그린","paul201 스트레이트 크롭핏 데님진 (중청)","울 모헤어 스트라이프 니트 블랙","[비건레더] 크루얼티프리 셔링 ma-1 레더 점퍼 iro114 아이보리","컴포트 레이어드 티셔츠_black"
"10","컨템포러리 크롭 데님 자켓 블랙","플리츠 하프 라인 울 와이드 팬츠 멜란지 그레이","리버시블 쉬링 무톤 몬스터 패딩_sand beige","오버사이즈 트렌치 코트 cream","쿨탠다드 릴렉스 핏 크루 넥 반팔 티셔츠 [화이트]",NA,NA,"inglewood hq 가죽 백팩",NA,"lb houndstooth newsboy cap (brown)",NA,"5in og - 오리지널 독일군 스니커즈","바 사틴 실버 목걸이","[lounz+] 크루핏 와이넷 니트 가디건 brown","세미 부츠컷 데님 (블랙)","탑필 울 라운드 니트 (블루그레이)","[rds인증] 베이지 bt1 쇼트 구스 다운 점퍼 (bc1938c71a)","레이어드 크루 넥 반팔 티셔츠_긴 기장 [화이트]"
"11","[사은품 증정][cb] 스포츠클럽 바시티 스타디움 자켓 블랙","로프 와이드 더블 데님 팬츠",NA,"오버사이즈 울 트렌치 코트 [beige]","심볼 반팔 티셔츠 (그레이)",NA,NA,"neumont 4 백팩 black hr609001",NA,"bpg check hunting cap (grey)",NA,"[프리미엄] 에베레스트 5cm키높이 스니커즈","[rushoff] benedictus ring necklace /베네딕토 링 목걸이(925 은도금)","미니멀 가디건 [반다이크 브라운]","kipas 스트레이트 데님 팬츠 [라이트 인디고]","피렌체 v 래글런 니트 블랙","3m 신슐레이트 퀄티드 점퍼 블랙","롱슬리브 티셔츠(검정)"
"12","코듀라 로우 데님 1st 모델 트러커 자켓","카본 코팅 세미 와이드 팬츠 (블랙)",NA,"울 100 개버딘 트렌치 코트 [머드베이지]","수피마 코튼 세미오버핏 티셔츠 (화이트)",NA,NA,"[air smith]블랙 가죽배색 백팩 dbba1e675bk",NA,"bg check hunting cap (brown)",NA,"887 뮌헨 독일군 스니커즈 빈티지화이트","바 사틴 실버 목걸이","오디너리 크롭 가디건 블랙","콤보 스트레이트컷 데님 미들 블루","v142 캐시 울 니트 집업 (그레이)","3m 신슐레이트 퀄티드 점퍼 블랙","폰테 크루 넥 긴팔 티셔츠 [오프 화이트]"
"13","ykk 2-way 테크 숏 자켓_그레이","kipas 스트레이트 데님 팬츠 [라이트 인디고]",NA,"코튼 오버사이즈 맥 코트 [베이지]","wild 수피마 티셔츠",NA,NA,"남자시계 fc-718wm4h4 매뉴팩처 클래식 월드타이머",NA,"1870 escape jeans [boot cut]",NA,"서울 스니커즈 01 [otau-wt04]","써지컬스틸 더블링 팬던트 목걸이 (c2101-an697_sv)","오버핏 울 가디건 (그레이)","컷오프 패널드 데님 팬츠 (블랙)","유니섹스 니쥬 하프 니트 집업 아이보리","[비건 레더] 리버시블 보아 플리스 점퍼 브라운","베이식 긴팔 티셔츠 [화이트]"
"14","라인 바시티 나일론 자켓 (navy)","콘트라스트 스티치 레귤러 핏 데님 팬츠 [크림]",NA,"울 블랜드 롱 트렌치 코트 dark brown","필드데이 셔츠_lilac",NA,NA,"코듀라 오버사이즈 백팩",NA,"bs herringbone hunting cap (brown)",NA,"[프리미엄] 에베레스트 5cm키높이 스니커즈","surgical steel dual circle pendant chain necklace  / 듀얼 써클 펜던트 체인목걸이","카라 가디건 (파우더 베이지)","뉴웨이브 와이드 데님 미들 블루","린넨 레이어드 풀오버 가디건 니트 (블랙)",NA,"쿨탠다드 릴렉스 핏 크루 넥 반팔 티셔츠 [화이트]"
"15","[reorder] 파이핑 후드 자켓 (블루)","밴딩 실루엣 팬츠 모카베이지",NA,"sasaki 더블 포켓 트렌치코트 melange brown","시티보이 빅오버 옥스포드 셔츠_off white",NA,NA,"니오 듀크 모노그램 레더 백팩 mmkasdk01bk",NA,"short visor mods cap / v embo / gray",NA,"레더 코트 스니커즈 [화이트]","링크 패스 락 목걸이","오디너리 크롭 가디건 그린","lot.021 휠맨 컴포트 데님","크리켓 니트 베스트 (아이보리)",NA,"[2pack] 베이식 무지 레이어드 반팔 티셔츠 일반 기장"
"16","셀비지 데님 자켓 (다크블루)","시티보이 원턱 벌룬 팬츠 (ivory)",NA,"오버사이즈 울 트렌치 코트 [beige]","컴포트 레이어드 티셔츠_black",NA,NA,"니오 듀크 모노그램 레더 백팩 mmkasdk01bk",NA,"linen-cotton newsboy cap (brown)",NA,"10in wp - 방수 독일군 스니커즈","잠금장치 목걸이 ver.crater","아가일 모헤어 니트 가디건 살몬","[amber 1058] 커버밴드 세미 루즈 스트레이트 생지 데님 팬츠 (진청)","오픈 칼라 그리드 니트 natural cream",NA,"레이어드 크루 넥 긴팔 티셔츠_긴 기장 [화이트]"
"17","파이버 디테처블 3way 자켓 블루","kipas 스트레이트 데님 팬츠 [라이트 인디고]",NA,"밀 m-51 피쉬테일 야상 코트 카키","시티보이 빅오버 옥스포드 셔츠_royal blue",NA,NA,"니오 듀크 모노그램 레더 백팩 mmkasdk01bk",NA,"us deck cotton matroos cap [black]",NA,"earth 친환경 스니커즈 (화이트)","스퀘어 로고 92.5 유광실버 목걸이 562","램스울 헤비듀티 니트 가디건 (브라운)","크리즈 와이드 데님 팬츠","콤피 울 니트(브라운)",NA,"베이직 아워파라데 티셔츠 화이트 반팔티"
"18","플리스 집업 자켓 블랙","컷오프 패널드 데님 팬츠 (블랙)",NA,"울 하프 코트 블랙","레이어드 크루 넥 반팔 티셔츠_긴 기장 [화이트]",NA,NA,NA,NA,"big apple [2way] - basic color newsboy cap - wine",NA,"5cm 유니섹스 독일군 스니커즈 제너럴(cl0035)","[unisex] 피더파트 석버니쉬 목걸이","2022 노맨틱 베이직 로고 울 가디건 올리브","스트레이트 데님 팬츠 [블랙]","미니멀 크루 넥 니트 [베이지]",NA,"헨리넥 니트 티셔츠 [cream]"
"19","커버올 워크자켓 greige","투 턱 와이드 팬츠 [브라운]",NA,"캐시미어 블렌드 대디 숄더 싱글 롱 코트 [반다이크 브라운]","롱슬리브 티셔츠(검정)",NA,NA,NA,NA,NA,NA,"심플라인 천연소가죽 베이직 스니커즈 1180 [white fg]","500 하프체인 92.5 무광실버 목걸이","오버핏 크롭 카라 가디건 [블랙]","kipas 스트레이트 데님 팬츠 [라이트 인디고]","북극사 오픈카라 니트 (5color)",NA,"에센셜 레이어드 롱 슬리브 티셔츠 (white)"
"20","테크니트 스타디움 자켓 heather charcoal","오디너리 테이퍼드 투턱 벨트 팬츠_soft cream",NA,"하프앤하프 발마칸 코트 [black]","[에코레더] 셔츠 자켓_brown",NA,NA,NA,NA,NA,NA,"그랜드 크로스코트 스니커즈 white","팀 위드 라피스 목걸이","2022 ilp 시그니쳐 와펜 라운드 가디건 바질","와이드 데님 팬츠 (r.black)","s/s 스트라이프 카라 니트 아이보리",NA,"레이어드 크루 넥 긴팔 티셔츠_긴 기장 [화이트]"
"21","커버올 워크자켓 mocha","[amber 1058] 커버밴드 세미 루즈 스트레이트 생지 데님 팬츠 (진청)",NA,"울 100% 체크 더블 코트","시티보이 빅오버 옥스포드 셔츠_neutral gray",NA,NA,NA,NA,NA,NA,"5in white - 독일군 스니커즈","b026 [silver925] 투팬던트 목걸이","램스울 헤비듀티 니트 가디건 (네이비)","sl01 시밀러 린넨 데님 와이드 팬츠 (raw indigo)","cntt 소프트 알파카 울 니트(차콜블랙)",NA,"오버핏 벤트 레이어드 티셔츠 [white]"
"22","유틸리티 자켓 chino","구르카 울 팬츠 cream",NA,"히든 맥코트 베이지","퍼포레이트 니트 폴로 셔츠 (아이보리)",NA,NA,NA,NA,NA,NA,"레더 코트 스니커즈 [화이트]","스피어팬던트 써지컬스틸 체인목걸이 (c1901-an623sv)","울 니트 가디건 자켓_brown","셀비지 와이드 생지 데님 팬츠(raw denim)","펀칭 카라 하프 니트 (ivory)",NA,"레이어드 크루 넥 반팔 티셔츠_긴 기장 [화이트]"
"23","ykk 2-way 테크 숏 자켓_블랙","오디너리 테이퍼드 와이드 원턱 팬츠_black",NA,"오버사이즈 건 클럽 체크 맥 코트 [다크 브라운]","[네이키드니스x아노블리어] 오버핏 히든 플라켓 옥스포드 셔츠 [화이트]",NA,NA,NA,NA,NA,NA,"[프리미엄] 제너럴 독일군 스니커즈 베이지",NA,"플래그 니트 가디건_화이트","커브드 와이드 데님 팬츠_크림","네이비 볼드 스트라이프 칼라 니트_오버핏 (452251lq1r)",NA,"[세트] 에센셜 오버핏 스웨트티셔츠"
"24","바시티크루 자켓 버건디 stot3400","크리즈 와이드 데님 팬츠",NA,"레더 코트 스니커즈 [블랙]","폰테 크루 넥 긴팔 티셔츠 [오프 화이트]",NA,NA,NA,NA,NA,NA,"4.5cm+ 키높이 독일군 스니커즈(german original)",NA,"오버핏 브러쉬 아가일 니트 가디건 [화이트]","핀턱데님팬츠(블루)","풀하찌반집업니트 크림",NA,"특양기모 목폴라 니트 티셔츠 off white"
"25","와이드 벌룬 m-65 퀼팅 필드 자켓 mjk108 [black]","스트레이트 데님 팬츠 [블랙]",NA,"벨티드 오버사이즈 코트 cream","베이식 긴팔 티셔츠 [화이트]",NA,NA,NA,NA,NA,NA,"4.5cm+ 키높이 독일군 스니커즈 (german white)",NA,"헤링본 램스 울 니트 가디건 아이보리 cooscd011ivory","세미 와이드핏 롱 데님 팬츠_아이보리","헤비 코튼 메쉬 집 후드 메쉬 아우터 니트 페럴 아이보리",NA,"레이어드 크루 넥 긴팔 티셔츠_긴 기장 [화이트]"
"26","코듀로이 바시티 자켓  그린","kipas 스트레이트 데님 팬츠 [라이트 인디고]",NA,"비건 레더 맥코트 black","시티보이 투포켓 트윌 셔츠-블루",NA,NA,NA,NA,NA,NA,"model. k2f2wh man sneakers 스니커즈 september nine(셉템버나인)",NA,"캐시미어 블렌드 가디건 [아보카도]","레귤러 핏 데님 팬츠 [워시드 블랙]","퍼포레이트 니트 폴로 셔츠 (아이보리)",NA,"특양기모 목폴라 니트 티셔츠 off white"
"27","[set] ykk 2-way 테크 숏 자켓 셋업_블랙","딥 플리츠 커브드 팬츠 (크림)",NA,"캐시미어 핸드메이드 싱글 로브 코트 melange brown","화이트 옥스포드 기본 셔츠_레귤러핏 (422164ly11)",NA,NA,NA,NA,NA,NA,"4.5cm+ 키높이 독일군 스니커즈 (german white)",NA,"오리엔탈 패딩 두루마기 가디건","쿨맥스 슬림 크롭 데님 팬츠 [미디엄 인디고]","오버사이즈 집업 카라 터틀넥 니트 [black]",NA,"퍼펙트 터틀넥 니트 티셔츠 블랙"
"28","소프트 크랙 오버 윈드 자켓 [black]","와이드 데님 팬츠 (r.black)",NA,"mnss 마운트 롱코트 (올블랙)","썸머 알파카 니트 셔츠 트랜스퍼 레이어링 셔츠 퓨리 아이보리",NA,NA,NA,NA,NA,NA,"남여공용 레더 스니커즈 lsm003 - 화이트",NA,"2022 ilp 시그니쳐 와펜 라운드 가디건 바질","언체인징 데님 와이드 레그 팬츠  (인디고)","6믹스 니트 베스트 - 블랙 믹스 (fl-150)",NA,"기모 하프 폴라 니트 티셔츠 ivory"
"29","navy 덱 봄버 자켓","버뮤다 팬츠 (블랙)",NA,"오버사이즈 마리오벨루치 더블 코트 (카멜)","퍼스 라쿤 칼라 셔츠 가디건 하이랜드 그린",NA,NA,NA,NA,NA,NA,"히말라야 스니커즈",NA,"m2060 울 카라 가디건 (차콜그레이)","카이엔_원 턱 테일러드 벨티드 데님_소피아 브라운","벌키 브러쉬 아가일 니트 seed",NA,"[세트]  하프 폴라 니트 티셔츠"
"30","[울] 스타디움 자켓_022","sl01 시밀러 린넨 데님 와이드 팬츠 (raw indigo)",NA,"오버사이즈 건 클럽 체크 맥 코트 [브라운]","사이드 립 하프 집업 스웻셔츠 (브라운)",NA,NA,NA,NA,NA,NA,"ttbbs0106c34wh 베이직 레더 스니커즈 화이트",NA,"m2062 울 카라 가디건 (크림)","로프 와이드 더블 데님 팬츠","이비자_네츄럴 메시드니트_블루",NA,"퍼펙트 터틀넥 니트 티셔츠 블랙"
"31","c 로고 울 바시티 자켓 네이비","셀비지 와이드 생지 데님 팬츠(raw denim)",NA,"21fw03nm06 오버핏 더블 브레스티드 롱 코트 (카멜)","오버핏 옥스퍼드 셔츠 (white)",NA,NA,NA,NA,NA,NA,"earth 친환경 스니커즈 (화이트)",NA,"테디베어 앙고라 가디건 애쉬 그레이","kipas 스트레이트 데님 팬츠 [미디엄 인디고]","s/s 스트라이프 카라 니트 아이보리",NA,"폰테 터틀 넥 긴팔 티셔츠 [블루 그레이]"
"32","스티치 필드 자켓_블랙","커브드 와이드 데님 팬츠_크림",NA,"ol198_발마칸 울 코트_블랙체크","크로셰 셔츠 아가일 코튼 메쉬 셔츠 아이보리",NA,NA,NA,NA,NA,NA,"4.5cm+ 키높이 독일군 스니커즈 (german white)",NA,"체커보드 자카드 가디건 (블랙)","lot.021 휠맨 컴포트 데님","화란 세미오버 니트 버터",NA,"텐스 오버핏 터틀넥 티셔츠 크림 yhlt2309"
"33","카디 오버핏 ma-1 자켓 블랙 yhjk2319","핀턱데님팬츠(블루)",NA,"라이트카키 핸드메이드 내피탈부착 롱 코트lhw21769","쿨탠다드 릴렉스 핏 크루 넥 반팔 티셔츠 [화이트]",NA,NA,NA,NA,NA,NA,"ntsss0106c36wh 시그니쳐 스니커즈2.0 킵화이트",NA,"미니멀 가디건 [미드나잇 블루]","kipas 스트레이트 데님 팬츠 [딥 인디고]","썸머 알파카 니트 셔츠 트랜스퍼 레이어링 셔츠 퓨리 아이보리",NA,"퍼펙트 터틀넥 니트 티셔츠 블랙"
"34","[cb] 시그니처 로고 우븐 바시티 스타디움 자켓","세미 와이드핏 롱 데님 팬츠_아이보리",NA,"건 클럽 체크 대디 숄더 싱글 롱 코트 [다크 브라운]","[2pack] 베이식 무지 레이어드 반팔 티셔츠 일반 기장",NA,NA,NA,NA,NA,NA,"ron 스니커즈 w977084nc-m",NA,"v126 하이넥 니트 가디건 (브라운)","데님 컷오프 자켓 (블랙)","카라 하프 집업 니트 크림",NA,"하프 폴라 니트 티셔츠 오프화이트"
"35","[unisex]플라워 도트 자수 화이트클립 청자켓_블랙","레귤러 핏 데님 팬츠 [워시드 블랙]",NA,"뉴 포멀 울 싱글 코트_차콜","레이어드 크루 넥 긴팔 티셔츠_긴 기장 [화이트]",NA,NA,NA,NA,NA,NA,"히든 오픈 로고 wy2s0830xzu 0ni 남자 스니커즈",NA,"cb 알파카 브이넥 가디건 (카키)","와이드 데님 팬츠 (deep grey)","소프트코튼 헤비 와플 하프 집업 니트 ivory",NA,"폰테 터틀 넥 긴팔 티셔츠 [블랙]"
"36","브루클린 이글스 에슬레틱 클럽 스타디움 자켓 블랙","쿨맥스 슬림 크롭 데님 팬츠 [미디엄 인디고]",NA,"체크 로브 더블 코트 [glen check]","헤비웨이트 오버사이즈 옥스포드 셔츠 [화이트]",NA,NA,NA,NA,NA,NA,"3cm 소가죽 독일군 스니커즈 베일리(cr0012)",NA,"아가일 니트 가디건  (psrbwsw061_pu)","펠리페블랙 테이퍼드 데님 팬츠","베이직 니트 가디건_모카",NA,"터틀 하이 벤트 레이어드 티셔츠 [white]"
"37","세미오버핏 데님 트러커 후드 자켓 블랙","벨티드 투플리츠 울 팬츠 dark grey",NA,"pd-107 퀼팅 발마칸 코트_bk","화이트 옥스포드 기본 셔츠_레귤러핏 (422164ly11)",NA,NA,NA,NA,NA,NA,"ttbba0106c34wh 독일군 레더 스니커즈 화이트",NA,"미니멀 가디건 [오트밀]","릴렉스드 와이드 생지 데님 팬츠","화란 세미오버 니트 크림",NA,"small-globe 터틀넥 긴팔 티셔츠"
"38","3m 신슐레이트 스타디움 자켓 카키","코튼 와이드 팬츠 (에버닌)",NA,"뉴 포멀 울 싱글 코트_차콜","베이직 아워파라데 티셔츠 화이트 반팔티",NA,NA,NA,NA,NA,NA,"레더 코트 스니커즈 [블랙]",NA,"아가일 모헤어 니트 가디건 올리브","카이엔_원 턱 테일러드 벨티드 데님_소피아 브라운","소프트코튼 헤비 와플 하프 집업 니트 black",NA,"[세트]  하프 폴라 니트 티셔츠"
"39","바시티 자켓_네이비(en2bfmb930a)","미떼_모던 메란지 셋업 팬츠_에버닌",NA,"피코트 다크 브라운","헨리넥 니트 티셔츠 [cream]",NA,NA,NA,NA,NA,NA,"wtrd3104 시몬 오리진 독일군 스니커즈 그레이 [230~290mm]",NA,"v126 하이넥 니트 가디건 (브라운)","lot.026 헐리우드 슬림 데님 블랙 원워시","워셔블 하찌 니트 - 10 color",NA,"폰테 터틀 넥 긴팔 티셔츠 [오프 화이트]"
"40","리치 오버 ma-1 자켓 블랙 yhjk2269","울 세미 와이드 벨티드 팬츠 블랙",NA,"건 클럽 체크 대디 숄더 싱글 롱 코트 [브라운]","에센셜 레이어드 롱 슬리브 티셔츠 (white)",NA,NA,NA,NA,NA,NA,"저메인 레더 스니커즈 - 화이트",NA,"[men] 리브드 집업 가디건_light grey","데님 컷오프 자켓 (라이트그레이)","[lounz+] 미니멀 브이넥 니트 베스트 brown",NA,"브리드 모크넥 롱 슬리브 티셔츠 [white]"
"41","프렌치 타입 워크 자켓 베이지","언체인징 데님 와이드 레그 팬츠  (인디고)",NA,"핀치백 클래시 발마칸 코트(chacoal grey)","시티보이 보트자수 옥스포드 오버핏 셔츠 (white)",NA,NA,NA,NA,NA,NA,"남여공용 레더 스니커즈 lsm001 - 화이트",NA,"테디베어 앙고라 가디건 테디 베어","m168 슬림 스트레이트 크롭 데님 팬츠_그레이","화란 세미오버 니트 아보카도",NA,"[패키지] 텐스 오버핏 터틀넥 티셔츠 6종 2pack yhlt2309"
"42","로고 울혼방 바시티 자켓[black](uoxbuj21_39)","로프 와이드 더블 데님 팬츠",NA,"휴즈 울 피코트 (dark navy)","썸머 알파카 니트 셔츠 트랜스퍼 레이어링 셔츠 퓨리 아이보리",NA,NA,NA,NA,NA,NA,"웨버 오리진 스니커즈 (0087235) wv21050 wh",NA,"a.p 크롭 가디건 블랙","[men]커디 트위스트 데님 팬츠_화이트","[lounz+] 크루핏 와이넷 니트 가디건 brown",NA,"하프 폴라 니트 티셔츠 오프화이트"
"43","pnv026 나일론 셔츠 자켓 (다크 그레이)","kipas 스트레이트 데님 팬츠 [미디엄 인디고]",NA,"21fw03nm08 핸드메이드 리치 울 더블 롱 코트 (헤링본)","크레이프 셔츠 (크림)",NA,NA,NA,NA,NA,NA,"제논 남성 스니커즈 화이트 el20a007",NA,"벌키 브러쉬 아가일 가디건 dark black","커브드 와이드 데님 팬츠_크림","탑필 울 라운드 니트 (블랙)",NA,"하프 폴라 니트 티셔츠 블랙"
"44","빈티지 무드 베이스볼 자켓 (네이비)","kipas 스트레이트 데님 팬츠 [딥 인디고]",NA,"울 히든 발마칸 코트 브라운","레이어드 크루 넥 긴팔 티셔츠_긴 기장 [화이트]",NA,NA,NA,NA,NA,NA,"ttbba0106c34wh 독일군 레더 스니커즈 화이트",NA,"엘보우 섹션 루즈핏 헤비 가디건 블랙","레인 트위스트 데님 팬츠 로우 블루_men","이비자 네츄럴 메시드 니트 그레이 라벤더",NA,"[세트]  하프 폴라 니트 티셔츠"
