"","jacket","pants","padding","coat","shirt","sweatshirt","mentomen","pack","shorts","cap","socks","shoes","necklace","gardigan","jean","neat","jumper","tshirt"
"370","스톤워싱 헤비 트러커 자켓 베이지","selvedge denim pants deep indigo",NA,NA,"(unisex)네츄럴 하프 니트 폴라 티셔츠_black",NA,NA,NA,NA,NA,NA,NA,NA,NA,NA,"라이크 리넨 드롭 크루넥 니트_베이지",NA,NA
"371","피쉬테일 자켓 ivory","[스탠다드]21ss wide fit tr one tuck pants black",NA,NA,"클래식핏 플래드 옥스포드 셔츠 - 멀티",NA,NA,NA,NA,NA,NA,NA,NA,NA,NA,"캐시미어 블렌드 크루 넥 니트 [아이보리]",NA,NA
"372","베이스볼 코튼 자켓_라이트 그레이","bermuda mid pants black",NA,NA,"슬림핏 샴브레이 셔츠 - 블루",NA,NA,NA,NA,NA,NA,NA,NA,NA,NA,"미니멀 크루 넥 니트 [아보카도]",NA,NA
"373","숏 밀리터리 자켓 (베이지)","[오리지널스]comfy one tuck selvage denim pants_black",NA,NA,"[unisex]  하프믹스 체크 셔츠 (check black)",NA,NA,NA,NA,NA,NA,NA,NA,NA,NA,"미니멀 크루 넥 니트 [미디엄 그레이]",NA,NA
"374","클린 로우 컷 넥 집 데님 자켓_블루","fatigue chino pants cream beige",NA,NA,"슬림 핏 포플린 셔츠 - 블루",NA,NA,NA,NA,NA,NA,NA,NA,NA,NA,"수피마 코튼 크루 넥 니트 [블랙]",NA,NA
"375","2-way 유틸리티 ma-1 자켓_크림","two-tuck cropped pants - black",NA,NA,"cwss-2001 컷앤쏘잉 컬렉션 밀리터리 투톤 헤비 스웻셔츠 버건디",NA,NA,NA,NA,NA,NA,NA,NA,NA,NA,"캐시미어 블렌드 모크 넥 니트 [아이보리]",NA,NA
"376","플리스 집업 자켓 블랙","t&t denim pants - black",NA,NA,"[slim] 그레이 솔리드 헤링본 셔츠 (bc0964a253)",NA,NA,NA,NA,NA,NA,NA,NA,NA,NA,"램스울 니트 베스트 아이보리",NA,NA
"377","051 트러커 데님자켓","20ss venti wide half pants brown",NA,NA,"베이직 옥스포드 버튼 다운 셔츠_화이트",NA,NA,NA,NA,NA,NA,NA,NA,NA,NA,"화란 세미오버 니트 모카 베이지",NA,NA
"378","코듀라 워싱 데님 라이더 자켓","wide crop chino pants l grey",NA,NA,"화이트라벨 포켓 롱 슬리브 티셔츠 블랙",NA,NA,NA,NA,NA,NA,NA,NA,NA,NA,"알파카 오버핏 라운드 니트 그레이시 그린",NA,NA
"379","플리스 집업 자켓 스카이블루","[스탠다드]21ss wide fit tr one tuck pants light brick",NA,NA,"콘트라스트 스티치 스웨트셔츠 [크림]",NA,NA,NA,NA,NA,NA,NA,NA,NA,NA,"라이크 리넨 드롭 크루넥 니트_베이지",NA,NA
"380","워싱 스티치 데님자켓 (black)","twill two tuck wide pants (dark brown)",NA,NA,"히든 버튼 드레스 셔츠 [스카이 블루]",NA,NA,NA,NA,NA,NA,NA,NA,NA,NA,"탑필 울 라운드 니트 (다크브라운)",NA,NA
"381","베이스볼 코튼 자켓_라이트 그레이","balloon snap pants(beige)",NA,NA,"루즈핏 오픈카라 텐셀 린넨 셔츠 [오트밀]",NA,NA,NA,NA,NA,NA,NA,NA,NA,NA,"화란 세미오버 니트 애쉬 블루",NA,NA
"382","2-way 유틸리티 ma-1 자켓_크림","soft lyocell easy pants (charcoal)",NA,NA,"린넨라이크 스트라이프 헨리넥 셔츠 베이지 1ththa5msu133",NA,NA,NA,NA,NA,NA,NA,NA,NA,NA,"알파카 오버핏 라운드 니트 베이지",NA,NA
"383","코듀라 로우 데님 1st 모델 트러커 자켓","wide linen pants [light khaki]",NA,NA,"제니 오버핏 셔츠 화이트 yhls2185",NA,NA,NA,NA,NA,NA,NA,NA,NA,NA,"공용 트리컬러 폭스 패치 클래식 라운드 넥 니트 - 그레이 / fu00502kt1036grm",NA,NA
"384","2-way 유틸리티 ma-1 자켓_크림","s.l short pants - gray",NA,NA,"기자 cp 스판 세미오버핏 티셔츠 (스카이블루)",NA,NA,NA,NA,NA,NA,NA,NA,NA,NA,"알파카 오버핏 라운드 니트 베이지",NA,NA
"385","코드 후드 집업 자켓 스모크 그레이","stripe or plain wide pants (stripe black)",NA,NA,"스트라이프 쿨링 반팔셔츠 네이비",NA,NA,NA,NA,NA,NA,NA,NA,NA,NA,"크루넥 리브 니트 스웨터_브라운",NA,NA
"386","생지 블루 데님 자켓","wide-leg long pants - black",NA,NA,"오픈카라 티셔츠 [dusty cream]",NA,NA,NA,NA,NA,NA,NA,NA,NA,NA,"화란 세미오버 니트 블랙",NA,NA
"387","유틸리티 숏 자켓_그레이","linen tapered pants beige",NA,NA,"릭렉스 우븐 티셔츠 relax woven ts",NA,NA,NA,NA,NA,NA,NA,NA,NA,NA,"캐시미어 울 블랜드 오버핏 니트_코발트",NA,NA
"388","워싱 스티치 데님자켓 (indigo)","modoo pants 모두바지(ivory)",NA,NA,"수피마 코튼 프리미엄 티셔츠 dark green",NA,NA,NA,NA,NA,NA,NA,NA,NA,NA,"캐시미어 울 블랜드 오버핏 니트_아이보리",NA,NA
"389","푸마 x 메종 키츠네 후드 롱 자켓 - 블랙 / 530438-01","wide one tuck denim pants indigo washed",NA,NA,"코튼 니트 티셔츠 avocado",NA,NA,NA,NA,NA,NA,NA,NA,NA,NA,"이비자_네츄럴 메시드니트_네츄럴 그린",NA,NA
"390","로고 패치 테크니컬 쉘 보머 자켓","one-tuck chino pants beige",NA,NA,"butter cream knit half shirts",NA,NA,NA,NA,NA,NA,NA,NA,NA,NA,"탑필 캐시미어 라운드 니트 (블루그레이)",NA,NA
"391","후드 자켓 (블루그레이)","jet pocket bermuda pants - floral white",NA,NA,"unisex logo crease t-shirt white_m_udts2a111wt",NA,NA,NA,NA,NA,NA,NA,NA,NA,NA,"캐시미어 100 크루 넥 니트 [미디엄 그레이]",NA,NA
"392","베이스볼 코튼 자켓_네이비","n//s stitch half pants - black",NA,NA,"aeca collar sweatshirt-light grey",NA,NA,NA,NA,NA,NA,NA,NA,NA,NA,"세미오버핏 케이블 니트 베스트 [클라우드 그레이]",NA,NA
"393","피치스킨 트윌 자켓 블랙","side two tuck pants - black",NA,NA,"crinkled cotton shirts white",NA,NA,NA,NA,NA,NA,NA,NA,NA,NA,"화란 세미오버 니트 크림",NA,NA
"394","옥스포드 사파리 자켓 아이보리 khot5081","basic chino pants beige",NA,NA,"tooth nap.check shirts (black)",NA,NA,NA,NA,NA,NA,NA,NA,NA,NA,"워셔블 니트 카라 grey_mobbsxm5111",NA,NA
"395","오버핏 데님 자켓 (연청)","paper yarn zen setup pants white",NA,NA,"standard fit oxford shirts off white",NA,NA,NA,NA,NA,NA,NA,NA,NA,NA,"에이씨 소프트 니트 베스트 빈티지브라운",NA,NA
"396","워싱 데님 자켓 (블루)","52pt] friday pants [뉴스탠다드]_m212mpt937m",NA,NA,"시그니처 베이직 셔츠 (화이트) signature basic shirt (white)",NA,NA,NA,NA,NA,NA,NA,NA,NA,NA,"공용 트리컬러 폭스 패치 클래식 라운드 넥 니트 - 그레이 / fu00502kt1036grm",NA,NA
"397","오버핏 램스킨 블루종 자켓","selvedge denim pants deep indigo",NA,NA,"basic l/s shirt",NA,NA,NA,NA,NA,NA,NA,NA,NA,NA,"탑필 울 라운드 니트 (웜샌드)",NA,NA
"398","ykk 2-way 테크 숏 자켓_그레이","heavy-terry balloon sweat pants (black)",NA,NA,"[스탠다드]21fw oversized fit denim shirt black",NA,NA,NA,NA,NA,NA,NA,NA,NA,NA,"펀칭 니트 베스트 black",NA,NA
"399","워싱 스티치 데님자켓 (black)","cliff tapered denim pants light indigo",NA,NA,"[스탠다드]21fw regular collar minimal shirts white",NA,NA,NA,NA,NA,NA,NA,NA,NA,NA,"콤피 울 니트(크림)",NA,NA
"400","2-way 유틸리티 ma-1 자켓_그레이","faux leather pants (black)",NA,NA,"m#1720 painting layered shirt (white)",NA,NA,NA,NA,NA,NA,NA,NA,NA,NA,"소프트코튼 드랍숄더 오버핏 와플 니트 black",NA,NA
"401","모디파이 2way 오버핏 ma-1 자켓_silver gray","[fw20] big corduroy straight pants(beige)",NA,NA,"cleaved oxford wrinkle shirts white",NA,NA,NA,NA,NA,NA,NA,NA,NA,NA,"이비자_네츄럴 메시드니트_네츄럴 그린",NA,NA
"402","크런치 집업 자켓 그레이","luster deep one tuck pants [light grey]",NA,NA,"daily turtle neck t-shirts (white) [glt602h33wha]",NA,NA,NA,NA,NA,NA,NA,NA,NA,NA,"베이직 니트 가디건_블랙",NA,NA
"403","코드 후드 집업 자켓 스모크 그레이","stitch denim pants one washed",NA,NA,"laundry shirt (lemon)",NA,NA,NA,NA,NA,NA,NA,NA,NA,NA,"엔젤 카라 반팔 니트 올리브",NA,NA
"404","에센셜 후드 아노락 자켓 grey","tapered banding pants brown(테이퍼드핏)",NA,NA,"daily half turtle neck t-shirts (black) [lrpfctr313mbka]",NA,NA,NA,NA,NA,NA,NA,NA,NA,NA,"블렌드 라운드 니트_올리브",NA,NA
"405","메탈 나일론 트랙자켓 그레이","color dyeing pants_oatmeal",NA,NA,"corduroy down shirts jacket black",NA,NA,NA,NA,NA,NA,NA,NA,NA,NA,"이비자_네츄럴 메시드니트_블루",NA,NA
"406","chmps 바람막이 자켓 set-up 블랙","denim roll-up pants - black washed",NA,NA,"og corduroy shirt _ mint",NA,NA,NA,NA,NA,NA,NA,NA,NA,NA,"베이직 니트 가디건_모카",NA,NA
"407","라디오 크루 자켓 knw001m(brown)","easy short pants navy",NA,NA,"[패키지] daily turtle neck t-shirts (white/black/charcoal/navy) [glt602h33]",NA,NA,NA,NA,NA,NA,NA,NA,NA,NA,"v094 부클 라운드 니트 (그레이)",NA,NA
"408","cwu 블루종 자켓 l/beige",NA,NA,NA,"overfit minimal color shirt_white",NA,NA,NA,NA,NA,NA,NA,NA,NA,NA,"캐시미어 울 블랜드 오버핏 니트_아이보리",NA,NA
"409","유틸리티 마고자켓 001 charcoal",NA,NA,NA,"[슬로우보이x프리즘웍스]21fw oversized button down shirt white",NA,NA,NA,NA,NA,NA,NA,NA,NA,NA,"라이크 리넨 드롭 크루넥 니트_블랙",NA,NA
"410","유틸리티 마고자켓 002 khaki",NA,NA,NA,"daily turtle neck t-shirts (white) [glt602h33wha]",NA,NA,NA,NA,NA,NA,NA,NA,NA,NA,"bk metal kint white short fedora 니트페도라",NA,NA
"411","유틸리티 마고자켓 001 blue",NA,NA,NA,"oxford over shirts beige",NA,NA,NA,NA,NA,NA,NA,NA,NA,NA,"케이블 니트 베스트 / 베이지",NA,NA
"412","[사은품 증정]컨템포러리 크롭 필드 자켓 3 라이트그레이",NA,NA,NA,"daily turtle neck t-shirts (white) [glt602h33wha]",NA,NA,NA,NA,NA,NA,NA,NA,NA,NA,"플랙스 라운드 니트 반팔 블랙",NA,NA
"413","쉘 자켓 mocha x aqua",NA,NA,NA,"laundry shirt (lemon)",NA,NA,NA,NA,NA,NA,NA,NA,NA,NA,"쿨에버 pk 반팔 니트티 navy",NA,NA
"414","피싱 경량 바람막이 자켓 black",NA,NA,NA,"laundry shirt (lemon)",NA,NA,NA,NA,NA,NA,NA,NA,NA,NA,"플랙스 라운드 니트 반팔 소라",NA,NA
"415","[penfield x frizmworks] 마운틴 파카 후드 자켓 beige_fm1wj11m",NA,NA,NA,"에센셜 옥스포드 셔츠 essential oxford shirts",NA,NA,NA,NA,NA,NA,NA,NA,NA,NA,"쿨 소프트 숏 슬리브 카라 니트 블루",NA,NA
"416","cb 아콘 피그먼트 셔츠자켓 (그레이)",NA,NA,NA,"c.r.e.a.m overfit sweatshirt (black)",NA,NA,NA,NA,NA,NA,NA,NA,NA,NA,"브이넥 미니멀 니트 베스트 : 4color",NA,NA
"417","오버핏 데님 자켓 (연청)",NA,NA,NA,"oxford over shirts beige stripe",NA,NA,NA,NA,NA,NA,NA,NA,NA,NA,"쿨 소프트 숏 슬리브 카라 니트 오트밀",NA,NA
"418","윈드브레이커 자켓_베어베이지",NA,NA,NA,"aeca oversize oxford shirt-sky blue",NA,NA,NA,NA,NA,NA,NA,NA,NA,NA,"bk metal kint white long fedora 니트페도라",NA,NA
"419","후드 집업 자켓 그레이",NA,NA,NA,"oxford over shirts grey stripe",NA,NA,NA,NA,NA,NA,NA,NA,NA,NA,"시티보이 브이넥 니트베스트_민트",NA,NA
"420","5 years 101+ 데님 라이더 자켓 인디고 미디움",NA,NA,NA,"mr oxford oversize shirt (ivory)",NA,NA,NA,NA,NA,NA,NA,NA,NA,NA,"다니엘 오픈 카라 니트 반팔 올리브그린",NA,NA
"421","라디오 크루 자켓 knw001m(brown)",NA,NA,NA,"laundry shirt (white)",NA,NA,NA,NA,NA,NA,NA,NA,NA,NA,"소퍼닝 미니멀 니트 베스트 [black]",NA,NA
"422","오버핏 투웨이 워싱 데님 자켓 중청 sjot1164",NA,NA,NA,"oxford over shirts white",NA,NA,NA,NA,NA,NA,NA,NA,NA,NA,"에센셜 크루넥 하프니트 (sand gray)",NA,NA
"423","코듀라 워싱 데님 2pk 셔츠 자켓",NA,NA,NA,"laundry shirt (white)",NA,NA,NA,NA,NA,NA,NA,NA,NA,NA,"슬릿 니트 베스트 블랙",NA,NA
"424","m1970_라이트 데님 트럭커 자켓",NA,NA,NA,"stripe handsome dan shirt blue",NA,NA,NA,NA,NA,NA,NA,NA,NA,NA,"시티보이 브이넥 니트베스트_그레이",NA,NA
"425","디테처블 3way 자켓 그레이쉬 블루",NA,NA,NA,"oxst over shirts (mint)",NA,NA,NA,NA,NA,NA,NA,NA,NA,NA,"[mij] 21 드라이빙 수피마 코튼 오픈 카라 니트 - 라이트 그레이",NA,NA
"426","디테처블 3way 자켓 그레이",NA,NA,NA,"[patterned] tie dye patterned long sleeve shirt",NA,NA,NA,NA,NA,NA,NA,NA,NA,NA,"린넨 카라 하프 니트 베이지",NA,NA
"427","코듀라 로우 데님 1st 모델 트러커 자켓",NA,NA,NA,"(unisex) daily half striped t-shirts_white/navy",NA,NA,NA,NA,NA,NA,NA,NA,NA,NA,"[mij] 21 드라이빙 수피마 코튼 오픈 카라 니트 - 크림",NA,NA
"428","노맨틱 아모레 피크드 라펠 자켓 블랙",NA,NA,NA,"stripe pocket s/s shirts cream",NA,NA,NA,NA,NA,NA,NA,NA,NA,NA,"시티보이 브이넥 니트베스트_베이지",NA,NA
"429","워싱 데님 자켓 (블루)",NA,NA,NA,"leaf open collar shirt green",NA,NA,NA,NA,NA,NA,NA,NA,NA,NA,"xtk016 대퍼딜 꽈배기 니트 (khaki)",NA,NA
"430","리커넥트 오디너리 포켓 투웨이 트러커자켓_beige",NA,NA,NA,"292513 ribbed knit t-shirt(black)",NA,NA,NA,NA,NA,NA,NA,NA,NA,NA,"스카시 펀치 반팔 니트 오프 화이트",NA,NA
"431","코듀라 워싱 데님 로코 자켓",NA,NA,NA,"butter cream knit half shirts",NA,NA,NA,NA,NA,NA,NA,NA,NA,NA,"린넨 카라 하프 니트 베이지",NA,NA
"432","피치스킨 트윌 자켓 블랙",NA,NA,NA,"[sm21 soundslife] short sleeve shirt big boy fit white",NA,NA,NA,NA,NA,NA,NA,NA,NA,NA,"다니엘 오픈 카라 니트 반팔 스카이블루",NA,NA
"433","air force ranger 웜업 자켓 네이비 (un121cjk11)",NA,NA,NA,"solid linen box shirts [cream]",NA,NA,NA,NA,NA,NA,NA,NA,NA,NA,"미니멀 브이넥 니트 베스트 블랙",NA,NA
"434","리치 오버 ma-1 자켓 블랙 yhjk2269",NA,NA,NA,"oxford bd short shirts blue",NA,NA,NA,NA,NA,NA,NA,NA,NA,NA,"플랙스 라운드 니트 반팔 아보카도",NA,NA
"435","도미넌스 스웨이드 봄버 자켓 [deep grey]",NA,NA,NA,"solid linen box shirts [cream]",NA,NA,NA,NA,NA,NA,NA,NA,NA,NA,"브이넥 니트 베스트_블랙",NA,NA
"436","오버핏 싱글 레더 숏 자켓_블루",NA,NA,NA,"solid linen box shirts [sky blue]",NA,NA,NA,NA,NA,NA,NA,NA,NA,NA,"[리뉴얼 ver.] 린넨 카라 하프 니트 - 8 color",NA,NA
"437","오버핏 비건레더 블루종 자켓",NA,NA,NA,"09 oversized t-shirt - white",NA,NA,NA,NA,NA,NA,NA,NA,NA,NA,"6믹스 니트 베스트 - 차콜 믹스 (fl-150)",NA,NA
"438","코듀라 워싱 데님 로코 자켓",NA,NA,NA,"butter cream knit half shirts",NA,NA,NA,NA,NA,NA,NA,NA,NA,NA,"에센셜 카라 온오프 하프 니트 가디건 (sage green)",NA,NA
"439","웜 오버핏 ma-1 자켓 카키 mjot7413",NA,NA,NA,"solid box shirts [light grey]",NA,NA,NA,NA,NA,NA,NA,NA,NA,NA,"오픈 카라 반팔 니트 k7 블랙",NA,NA
"440","코튼 트윌 로코 자켓 베이지",NA,NA,NA,"[스탠다드]21ss open collar multi check half shirt brown check",NA,NA,NA,NA,NA,NA,NA,NA,NA,NA,"쿨 썸머 워셔블 오픈 카라니트(black)",NA,NA
"441","리버시블 레트로 플리스 자켓 mjk102 [beige]",NA,NA,NA,"basic t-shirt - white",NA,NA,NA,NA,NA,NA,NA,NA,NA,NA,"브이넥 미니멀 니트 베스트 : 4color",NA,NA
"442","(unisex) 오버사이즈 아가일 가디건 자켓_베이지",NA,NA,NA,"[스탠다드]21ss oversized minimal half shirt blue grey",NA,NA,NA,NA,NA,NA,NA,NA,NA,NA,"스카시 스트라이프 비치 니트_khaki stripe",NA,NA
"443","에비에이터 b-3 무스탕 자켓 [블랙]",NA,NA,NA,"[프리미엄] overfit basic half shirt_beige",NA,NA,NA,NA,NA,NA,NA,NA,NA,NA,"[리뉴얼 ver.] 린넨 카라 하프 니트 - 8 color",NA,NA
"444","나일론 후드 푸퍼자켓 네이비x크림",NA,NA,NA,"cotton short sleeve shirt (peach)",NA,NA,NA,NA,NA,NA,NA,NA,NA,NA,"[송필드 pick] xtk014 내셔널 플라워 니트 베스트 (cream)",NA,NA
"445","퍼커링 오버핏 ma-1 자켓_카키",NA,NA,NA,"lmc fighting ox short slv shirt red",NA,NA,NA,NA,NA,NA,NA,NA,NA,NA,"모크넥 하프 스프라이프 니트 티셔츠 화이트",NA,NA
"446","리버시블 보아 후리스 무스탕 자켓 bk/bk",NA,NA,NA,"butter cream knit half shirts",NA,NA,NA,NA,NA,NA,NA,NA,NA,NA,"린넨 카라 하프 니트 베이지",NA,NA
"447","오블리크 블랙 데님자켓 / gmcjk03bk",NA,NA,NA,"drunkers shirts white",NA,NA,NA,NA,NA,NA,NA,NA,NA,NA,"xtk019 릴리 배색 니트 (navy)",NA,NA
"448","트위치로고 플리스 집업자켓 네이비",NA,NA,NA,"embroidery handsome dan ss shirt ivory",NA,NA,NA,NA,NA,NA,NA,NA,NA,NA,"xtk016 대퍼딜 꽈배기 니트 (khaki)",NA,NA
"449","퀼팅자켓 quilting jacket",NA,NA,NA,"dv.lot 633 cotton shirts -ash khaki-",NA,NA,NA,NA,NA,NA,NA,NA,NA,NA,"[common][쿨]코튼카라반팔니트 mwkt3120",NA,NA
"450","램스킨 레더 구스다운 퀼티드 후드 자켓  [블랙]",NA,NA,NA,"aerial shirts",NA,NA,NA,NA,NA,NA,NA,NA,NA,NA,"[common][쿨]코튼카라반팔니트 mwkt3120",NA,NA
"451","메일러 플리스 자켓 ivory",NA,NA,NA,"y.e.s knit pk shirts white",NA,NA,NA,NA,NA,NA,NA,NA,NA,NA,"[mij] 21 삐꼴라 수피마 코튼 크루넥 니트 - 스카이",NA,NA
"452","코다크롬 플리스 자켓 sky blue",NA,NA,NA,"[스탠다드]21ss oversized minimal half shirt white",NA,NA,NA,NA,NA,NA,NA,NA,NA,NA,"미니멀 쇼트 슬리브 크루 넥 니트 [옵틱 화이트]",NA,NA
"453","로고 패치 테크니컬 쉘 보머 자켓",NA,NA,NA,"[스탠다드]21ss oversized minimal half shirt blue grey",NA,NA,NA,NA,NA,NA,NA,NA,NA,NA,"[블랙]b-라그랑 쇼츠 니트-민트",NA,NA
"454","벨티드 울 숏트렌치 자켓 베이지",NA,NA,NA,"oxford over shirts blue",NA,NA,NA,NA,NA,NA,NA,NA,NA,NA,"제리 카라 니트(미드나잇 블루)",NA,NA
"455","usaaf b-15a 플라이트 자켓",NA,NA,NA,"basic stripe oxford shirt (blue)",NA,NA,NA,NA,NA,NA,NA,NA,NA,NA,"v043 소프트 v넥 니트 (와인)",NA,NA
"456","3m 신슐레이트 푸퍼 패딩 자켓 블랙",NA,NA,NA,"[스탠다드]21ss oversized fit shirt yellow stripe",NA,NA,NA,NA,NA,NA,NA,NA,NA,NA,"쿨 소프트 롱 슬리브 카라 니트 그레이",NA,NA
"457","유니섹스 플리스 블록 집 업 자켓-아이보리",NA,NA,NA,"에센셜 옥스포드 셔츠 essential oxford shirts",NA,NA,NA,NA,NA,NA,NA,NA,NA,NA,"캐시미어 100 크루 넥 니트 [아보카도]",NA,NA
"458","mnts 하이넥 보아 플리스 자켓 (아이보리)",NA,NA,NA,"[스탠다드]21ss loose fit open collar shirts grey",NA,NA,NA,NA,NA,NA,NA,NA,NA,NA,"베이직 울 니트 5color",NA,NA
"459","m1924  오버핏 코듀로이 트러커 자켓 (베이지)",NA,NA,NA,"wooltan check shirts (cream)",NA,NA,NA,NA,NA,NA,NA,NA,NA,NA,"케이블 니트베스트 그레이",NA,NA
"460","3m 신슐레이트 푸퍼 패딩 자켓 애쉬 카키",NA,NA,NA,"soft stripe t-shirts (black)",NA,NA,NA,NA,NA,NA,NA,NA,NA,NA,"메리노울 모헤어 스트라이프 라운드 니트_브라운",NA,NA
"461","로고 패치 테크니컬 쉘 보머 자켓",NA,NA,NA,"(기모) nyc location sweatshirt (mint) [lrpwctm304mmia]",NA,NA,NA,NA,NA,NA,NA,NA,NA,NA,"wb 니트 가디건 블랙",NA,NA
"462","덱 자켓",NA,NA,NA,"c.r.e.a.m overfit sweatshirt (black)",NA,NA,NA,NA,NA,NA,NA,NA,NA,NA,"리버시블 dc 크루넥 풀오버 니트 차콜",NA,NA
"463","3m 신슐레이트 푸퍼 패딩 자켓 그레이",NA,NA,NA,"l/s 1pk check shirts red",NA,NA,NA,NA,NA,NA,NA,NA,NA,NA,"쿨 소프트 롱 슬리브 카라 니트 오트밀",NA,NA
"464","웜&코지 체크 셔츠 자켓_크림",NA,NA,NA,"fw20 daily fit flap shirt(long)_white",NA,NA,NA,NA,NA,NA,NA,NA,NA,NA,"벌키 브러쉬 아가일 니트 black",NA,NA
"465","plmt 에볼루션 후드 자켓 (화이트)",NA,NA,NA,"cross check cuffs shirt_oatmeal",NA,NA,NA,NA,NA,NA,NA,NA,NA,NA,"리브드 래글런 니트 [그레이]",NA,NA
"466","3m 신슐레이트 g-8 웹 자켓 그레이",NA,NA,NA,"multi st open shirts navy",NA,NA,NA,NA,NA,NA,NA,NA,NA,NA,"스프레이 페인트 크루 넥 풀오버 니트 크림",NA,NA
"467","케이 플리스 자켓 brown",NA,NA,NA,"zip up polo shirt mushroom",NA,NA,NA,NA,NA,NA,NA,NA,NA,NA,"리버서블 스프링 니트 (블랙)",NA,NA
"468","코딩 프린트 포레스트 그린 패딩 후드 자켓",NA,NA,NA,"damp over size stripe half shirt",NA,NA,NA,NA,NA,NA,NA,NA,NA,NA,"라운드넥 니트 가디건_오트밀",NA,NA
"469","포켓 구스 다운 자켓 dark sea green",NA,NA,NA,"pullover pique shirts [indigo]",NA,NA,NA,NA,NA,NA,NA,NA,NA,NA,"아가일 브이넥 니트 베스트_아이보리",NA,NA
"470","시티 보이 ma-1 자켓 (모카 브라운)",NA,NA,NA,NA,NA,NA,NA,NA,NA,NA,NA,NA,NA,NA,"브이넥 스트라이프 니트 그린",NA,NA
"471","에비에이터 b-3 무스탕 자켓 [브라운]",NA,NA,NA,NA,NA,NA,NA,NA,NA,NA,NA,NA,NA,NA,"캐시미어 울 니트라운드 블루스카이 20swfwknr",NA,NA
"472","유니섹스 글램 숏 푸퍼 자켓-블루",NA,NA,NA,NA,NA,NA,NA,NA,NA,NA,NA,NA,NA,NA,"소프트코튼 드랍숄더 오버핏 와플 니트 oatmeal",NA,NA
"473","본챔스x매일우유 양면 후리스 자켓 cetdmjk01iv",NA,NA,NA,NA,NA,NA,NA,NA,NA,NA,NA,NA,NA,NA,"알파카 브러쉬 니트 베스트[그린]",NA,NA
"474","3m 신슐레이트 보아 플리스 무톤 자켓 베이지",NA,NA,NA,NA,NA,NA,NA,NA,NA,NA,NA,NA,NA,NA,"엘리시움 포썸 니트 버프 베이지",NA,NA
"475","셰르파 자켓 - 베이지 / fw20-07-03b",NA,NA,NA,NA,NA,NA,NA,NA,NA,NA,NA,NA,NA,NA,"소프트 베이직 터틀넥 니트 아이보리",NA,NA
"476","래더 스트랩 무스탕 자켓 [네이비]",NA,NA,NA,NA,NA,NA,NA,NA,NA,NA,NA,NA,NA,NA,"미니멀 크루 넥 니트 [머쉬룸]",NA,NA
"477","남녀공용트리플렉스 레귤러핏 롱 자켓 (q0423ljkn1)",NA,NA,NA,NA,NA,NA,NA,NA,NA,NA,NA,NA,NA,NA,"소프트 코튼 크루넥 니트 코발트블루",NA,NA
"478","유니섹스 플리스 블록 집 업 자켓-아이보리",NA,NA,NA,NA,NA,NA,NA,NA,NA,NA,NA,NA,NA,NA,"울 언발란스 세미 오버핏 크루넥 풀오버 니트 네이비",NA,NA
"479","브라우니 플리스 레이어드 패딩 자켓 khaki",NA,NA,NA,NA,NA,NA,NA,NA,NA,NA,NA,NA,NA,NA,"크루넥 리브 니트 스웨터_블랙",NA,NA
"480","코다크롬 플리스 자켓 navy",NA,NA,NA,NA,NA,NA,NA,NA,NA,NA,NA,NA,NA,NA,"네이쳐 스트라이프 니트_리프 그린",NA,NA
"481","벨티드 무톤 자켓 (브라운)",NA,NA,NA,NA,NA,NA,NA,NA,NA,NA,NA,NA,NA,NA,"엘프 캐시미어 니트 애쉬블루",NA,NA
"482","코치 패딩 자켓 black",NA,NA,NA,NA,NA,NA,NA,NA,NA,NA,NA,NA,NA,NA,"메리노울100 풀오버니트 (다크그레이)",NA,NA
"483","코다크롬 플리스 자켓 navy",NA,NA,NA,NA,NA,NA,NA,NA,NA,NA,NA,NA,NA,NA,"텍스처드 믹스 오버 라운드니트 [grey]",NA,NA
"484","리버시블 플리스 웜업 자켓 아이보리",NA,NA,NA,NA,NA,NA,NA,NA,NA,NA,NA,NA,NA,NA,"ambition 라운드 니트 퓨어그레이 (mm0x51ns13)",NA,NA
"485","로얄 후리스 자켓 타이다이블랙",NA,NA,NA,NA,NA,NA,NA,NA,NA,NA,NA,NA,NA,NA,"소프트코튼 베이식 터틀넥 니트 dark green",NA,NA
"486","[set] ykk 2-way 테크 숏 자켓 셋업_그레이",NA,NA,NA,NA,NA,NA,NA,NA,NA,NA,NA,NA,NA,NA,"코튼 필링 모크넥 니트 - mustard",NA,NA
"487","헤비보아플리스 후디드자켓(틸)",NA,NA,NA,NA,NA,NA,NA,NA,NA,NA,NA,NA,NA,NA,"ambition 라운드 니트 체리레드 (mm0x51ns16)",NA,NA
"488","헤비트윌 트러커 자켓 (다크 브라운)",NA,NA,NA,NA,NA,NA,NA,NA,NA,NA,NA,NA,NA,NA,"벌키 브러쉬 아가일 니트 black",NA,NA
"489","코듀라 로우 데님 1st 모델 트러커 자켓",NA,NA,NA,NA,NA,NA,NA,NA,NA,NA,NA,NA,NA,NA,"하프 터틀넥 니트 세트",NA,NA
"490","워싱 코튼 셰르파 자켓 (브라운)",NA,NA,NA,NA,NA,NA,NA,NA,NA,NA,NA,NA,NA,NA,"(unisex)네츄럴 하프 니트 폴라 티셔츠_black",NA,NA
"491","nj3nl53c_비 베러 플리스 자켓",NA,NA,NA,NA,NA,NA,NA,NA,NA,NA,NA,NA,NA,NA,"소프트 그라데이션 라운드 니트 [mocha beige]",NA,NA
"492","레더 패치 보아 플리스 자켓 블랙",NA,NA,NA,NA,NA,NA,NA,NA,NA,NA,NA,NA,NA,NA,"램스울 리브드 터틀 넥 니트 [더스티 블루]",NA,NA
"493","코듀로이 데일리 블레이저 자켓 블랙",NA,NA,NA,NA,NA,NA,NA,NA,NA,NA,NA,NA,NA,NA,"피넛버터 터틀넥 니트 베이지 cjkn7434",NA,NA
"494","후드 집업 자켓 그레이",NA,NA,NA,NA,NA,NA,NA,NA,NA,NA,NA,NA,NA,NA,"믹시드 스트라이프 브이넥 니트 [cream]",NA,NA
"495","nj4fl71b_셰르파 플리스 2 자켓 ex",NA,NA,NA,NA,NA,NA,NA,NA,NA,NA,NA,NA,NA,NA,"미니멀 울 반목폴라 니트 [아이보리]",NA,NA
"496","밴드 칼라 라이더스 자켓 램 레더 (블랙)",NA,NA,NA,NA,NA,NA,NA,NA,NA,NA,NA,NA,NA,NA,"탑필 울 라운드 니트 (웜샌드)",NA,NA
"497","램스킨 싱글 라이더 자켓",NA,NA,NA,NA,NA,NA,NA,NA,NA,NA,NA,NA,NA,NA,"하프 터틀넥 니트 세트",NA,NA
"498","오피셜 레더 라이더자켓",NA,NA,NA,NA,NA,NA,NA,NA,NA,NA,NA,NA,NA,NA,"화란 세미오버 니트 제주",NA,NA
"499","숏 퀼팅 자켓 올리브",NA,NA,NA,NA,NA,NA,NA,NA,NA,NA,NA,NA,NA,NA,"화란 세미오버 니트 제주",NA,NA
"500","nyco hooded oscar jacket _ ivory",NA,NA,NA,NA,NA,NA,NA,NA,NA,NA,NA,NA,NA,NA,"미니멀 모크 넥 니트 [더스티 블루]",NA,NA
"501","mild varsity jacket _ dark green",NA,NA,NA,NA,NA,NA,NA,NA,NA,NA,NA,NA,NA,NA,"소프트 베이직 터틀넥 니트 아이보리",NA,NA
"502","oversized 3 button tailored jacket_khaki gray",NA,NA,NA,NA,NA,NA,NA,NA,NA,NA,NA,NA,NA,NA,"캐시미어 100 터틀 넥 니트 [아이보리]",NA,NA
"503","clover bayport jacket-green",NA,NA,NA,NA,NA,NA,NA,NA,NA,NA,NA,NA,NA,NA,"니트 긴팔티 화이트",NA,NA
"504","intl. team jacket charcoal",NA,NA,NA,NA,NA,NA,NA,NA,NA,NA,NA,NA,NA,NA,"소프트코튼 드랍숄더 오버핏 와플 니트 stone blue",NA,NA
"505","2724 washing denim jacket (black)",NA,NA,NA,NA,NA,NA,NA,NA,NA,NA,NA,NA,NA,NA,"scouts boy 니트 khaki",NA,NA
"506","intl. team jacket black",NA,NA,NA,NA,NA,NA,NA,NA,NA,NA,NA,NA,NA,NA,"코튼 니트 티셔츠 avocado",NA,NA
"507","cliff over fit denim jacket (cone® denim) washed black",NA,NA,NA,NA,NA,NA,NA,NA,NA,NA,NA,NA,NA,NA,NA,NA,NA
"508","varsity blouson jacket grey",NA,NA,NA,NA,NA,NA,NA,NA,NA,NA,NA,NA,NA,NA,NA,NA,NA
